title,url,image,openTypeList,detail,baseInfoKeyList,baseInfoValueList
丙溴磷,http://www.baike.com/wiki/丙溴磷,http://a2.att.hudong.com/76/66/50200009239445155972667653283_s.jpg,农药##杀虫剂,丙溴磷，适用于防治棉铃虫、棉蚜、红铃虫、二三化螟、稻纵卷叶螟、韭蛆等。,中文名称：##外文名：##别名：##化学式：##IUPAC名：##CAS号：##摩尔质量：##外观：##密度：##沸点：##溶解度（水）：,丙溴磷##profenofos##多虫磷、丙溴灵、多虫清##C11H15BRCLO3PS##O-乙基-O-(4-溴-2-氯苯基)-S-丙基硫代磷酸酯##41198-08-7##373.63##淡黄色固体##1.455（20℃）##110（0.13Pa)##20mg/L（20℃）
北京艺辉天成科技发展有限公司,http://www.baike.com/wiki/北京艺辉天成科技发展有限公司,//www.huimg.cn/entry/images/summary_default270x233.png,企业##杀虫剂,企业精神：全心全意致力于全中国人民的健康生活环境! 公司介绍： 公司以中国农业大学、中国农科院等高等院校为技术依托，科研实力雄厚，是集专业环境卫生杀虫剂的研发、生产、销售、服务为一体的综合性企业。,中文名称：,北京艺辉天成科技发展有限公司
吡虫啉水分散性粒剂,http://www.baike.com/wiki/吡虫啉水分散性粒剂,//www.huimg.cn/entry/images/summary_default270x233.png,农药##杀虫剂,用药量 施用方法 蚜虫,,
丙虫磷,http://www.baike.com/wiki/丙虫磷,http://a1.att.hudong.com/53/92/20300544000509149422927450130_s.jpg,农业##农药##农药名##化工##杀虫剂##科学##自然科学##药物,纯品为无色无味液体。沸点176℃(112Pa)。易溶于常用有机溶剂，在水中的溶解度为125mg/L。,,
北京拜奥威环保科技有限公司,http://www.baike.com/wiki/北京拜奥威环保科技有限公司,//www.huimg.cn/entry/images/summary_default270x233.png,杀虫剂##环保,拜奥威集团是一批年轻的国内外博士投资组建的高科技公司，公司以“创造环保价值，共享生态地球”为己任，竭尽全力“关注生态环境，奉献环保产品”，极力奉行“责任、诚信、创新、卓越”的行为准则，致力于保护生态环境新技术和新产品的研究开发。研究开发应用于生态高尔夫球场、园林绿化等草坪病、虫、草害防治与生态养护的新技术和新产品；研究开发应用于高尔夫球场等人工河湖生态控藻与生态治理的新技术和新产品；研究开发污染场地生物修复的新技术和新产品；研究开发绿色能源环保材料的新技术和产品。,中文名称：,北京拜奥威环保科技有限公司
丙烯除虫菊酯,http://www.baike.com/wiki/丙烯除虫菊酯,http://a2.att.hudong.com/58/53/50200009239445155846532958422_s.jpg,杀虫剂,丙烯除虫菊酯，是以菊酯乙酯为起始原料，经皂化、酸化，再经酯化，制备成丙烯菊酯。菊酸乙酯、碱液和乙醇加热搅拌数小时，回收乙醇后，用酸酸化、溶剂萃取，脱去溶剂，即得产品菊酸。菊酸用三氯化磷、光气进行酰氯化，减压蒸馏，收集72～76℃（133.3Pa）的馏分。即得菊酰氯。依次加入菊酰氯、烯丙醇酮、溶剂，在搅拌下缓慢滴加缚酸剂，反应数小时后加入水，溶剂萃取，依次用烯酸、烯碱和水洗涤，无水硫酸钠干燥后减压脱溶，即得丙烯菊酯。制剂有：蚊香，电热驱蚊片，气雾剂，40%液剂，油剂，粉剂，乳油，可湿性粉剂。,,
吡螨胺,http://www.baike.com/wiki/吡螨胺,//www.huimg.cn/entry/images/summary_default270x233.png,农药名##化学##杀虫剂##科学##自然科学,本品属酰胺类杀螨剂．对各种螨类和半翅目、同翅目害虫具有卓效，而旦对螨类各生长期均有速效和高效，持效期长．,中文名称：##外文名：##熔点：##分子式：##通用名称：##CA登记号：##蒸气压：,吡螨胺##Tebufenpyrad##61～62℃##C18H24CLN3O##治螨特##119168-77-3##0.010787mPa(40℃)
白杨透翅蛾性引诱剂,http://www.baike.com/wiki/白杨透翅蛾性引诱剂,//www.huimg.cn/entry/images/summary_default270x233.png,杀虫剂##生物化学##生物学##科学##自然科学##药剂,"白杨透翅蛾性引诱剂（sex pheromone of poplar clearwing），从雌白杨透翅蛾体内分离到的性信息素，十八碳-3-反式-13-顺式二烯醇，小鼠经口LD50>5000mg/kg。现已化学合成。用于诱捕白杨透翅蛾和预测预报。
 特点/白杨透翅蛾性引诱剂 编辑


			
		使用白杨透翅蛾性引诱剂诱捕白杨透翅蛾，具有对人、畜安全，不污染环境，不杀伤天敌等特点，是综合防治的一条无公害的新途径。
 方法/白杨透翅蛾性引诱剂 编辑


			
		方法简便、成本低廉，在同朔地区进行大面积应用中，防治效果极好。诱捕器间距为50-80m，剂量为600-800μg，以白色屋脊型诱捕器诱蛾效果最好，诱捕时间于5月底开始到7月中旬结束，日诱捕率最高峰为15～17时，悬挂诱捕器适宜位置是：成林在树冠中上部，苗圃幼树在路边。",,
百树德,http://www.baike.com/wiki/百树德,http://a3.att.hudong.com/18/65/50200009239445155366651610517_s.jpg,农药名##化学##有机物##科学##自然科学,"氟氯氰菊酯；百树得；百树菊酯、百治菊酯（RS）α-氰基-4-氟-3-苯氧基苄基（1RS,3RS;1RS,3RS）-3-（2，2-二氯乙烯基）-2，2-二甲基环丙烷羧酸酯。",中文名称：##外文名：##别名：##化学式：##CAS号：##RTECS：##密度：##熔点：##分子量：##BRN号：,"氟氯氰菊酯##Cyfluthrin##百树得##C22H18Cl2FNO3##68359-37-5##GZ1253000##（g/mL,25/4℃）：1.27～1.28##（ºC）：60##434.29##2788149"
保米磷,http://www.baike.com/wiki/保米磷,//www.huimg.cn/entry/images/summary_default270x233.png,农业##农药##农药名##化学##杀虫剂##科学##自然科学,一种高毒杀虫剂。,,
百治磷,http://www.baike.com/wiki/百治磷,//www.huimg.cn/entry/images/summary_default270x233.png,农业##农药##农药名##化学##杀虫剂##科学##自然科学,百治磷，有机磷农药。化学名称为3－二甲基磷氧基－N，N－二甲基异丁烯酰胺，是有机化合物，琥珀色液体，具有酯的气味。可与水，很多有机溶剂混溶。高毒类杀虫剂，人经口致死量估计为5 － 50mg/kg，皮肤接触也可中毒。,,
吡蚜酮,http://www.baike.com/wiki/吡蚜酮,http://a1.att.hudong.com/58/72/50200009239445155795726233041_s.jpg,农业##农药名##杀虫剂##科学##自然科学,吡蚜酮属于吡啶类或三嗪酮类杀虫剂，是全新的非杀生性杀虫剂，最早由瑞士汽巴嘉基公司于1988年开发，该产品对多种作物的刺吸式口器害虫表现出优异的防治效果。吡蚜酮对害虫具有触杀作用，同时还有内吸活性。在植物体内既能在木质部输导也能在韧皮部输导；因此既可用作叶面喷雾，也可用于土壤处理。由于其良好的输导特性，在茎叶喷雾后新长出的枝叶也可以得到有效保护。,中文名称：##化学式：##CAS登录号：##属 性：##开 发：,吡蚜酮##C10H11N5O##123312-89-0##吡啶类或三嗪酮类杀虫剂##1988年
苄氯菊酯,http://www.baike.com/wiki/苄氯菊酯,http://a2.att.hudong.com/14/54/50200009239445155666544349327_s.jpg,杀虫剂,苄氯菊酯，是一种化学品，淡黄至琥珀色粘稠液体，分子式为C21H20Cl2O3。它是一种抗寄生虫的药物，外用百灭宁用于皮肤，主要治疗疥疮、头虱。密度：1.19。熔点：34-35°C。沸点：465.9ºC at 760mmHg。闪点：10 °C。水溶解性：不溶。,中文名称：##化学式：,苄氯菊酯##C21H20Cl2O3
臭虫净,http://www.baike.com/wiki/臭虫净,http://a1.att.hudong.com/06/05/20300576309418157415054749567_s.jpg,农药##化学##杀虫剂,臭虫净是一种兼有触杀和胃毒作用的滞留喷洒杀虫剂，具有广谱、速效、持效期长等优点。可广泛应用于农业生产和家庭、宾馆、学校、宿舍等场所灭治蚊蝇、臭虫、虱子、蟑螂。对臭虫特别有效，可杀死虫卵。,,
臭虫克星,http://www.baike.com/wiki/臭虫克星,http://a2.att.hudong.com/42/00/50200009239445156016005074160_s.jpg,杀虫剂,本品是最新研制的一种具有广谱、快速、低毒、无臭、长效的滞留喷洒卫生杀虫剂。可广泛应用于宿舍、家庭、酒店等场所灭治臭虫；并可用于防治蟑螂、蚊子、苍蝇、跳蚤等害虫。,中文名：##主要成分：##包装规格：##性能：,臭虫克星##增效宝倍，硫磷，氯菊酯，胺菊酯##喷射剂 500ml##喷洒卫生杀虫剂
菜喜,http://www.baike.com/wiki/菜喜,//www.huimg.cn/entry/images/summary_default270x233.png,杀虫剂##植物##自然##蔬菜,菜喜的有效成分多杀霉素具有独特的杀虫机理，对人畜基本无毒，是土壤微生物产生的天然高活性物质，特别适合无公害蔬菜生产。,中文名：##原 理：##应 用：##性 质：,菜喜##杀虫机理##应 用##天然高活性物质
虫线磷,http://www.baike.com/wiki/虫线磷,//www.huimg.cn/entry/images/summary_default270x233.png,农药##化学品##杀虫剂##生物化学##药物,相对密度d251.207。 27℃时水中溶解1140mg/L。 制剂有46％乳油，5％、10％颗粒剂。,,
臭虫没,http://www.baike.com/wiki/臭虫没,http://a0.att.hudong.com/33/86/20300543285537143506863842555_s.jpg,杀虫剂,此词条暂无内容，欢迎您参与编辑，享受分享贡献知识的乐趣。建议您在编辑词条之前，可先参考帮助中心文档，了解更多关于词条规范的信息。同时也可先熟悉编辑器的使用。若有疑问，欢迎联系： 在线提问：帮助小组联系我们友情提示：编写内容之前需删除以上内容。,,
除虫精,http://www.baike.com/wiki/除虫精,//www.huimg.cn/entry/images/summary_default270x233.png,化学##昆虫##杀虫剂##生物##自然科学,除虫精为纯品为天色结晶，工业品为黄色油状液体，几乎不溶于水，易溶于多种有机溶剂。对光稳定，遇碱易分解，在酸性和中性条件下稳定，常温下可贮存2年以上。对人畜毒性低， 对鱼类毒性大。,中文学名：,除虫精
毒力指数,http://www.baike.com/wiki/毒力指数,//www.huimg.cn/entry/images/summary_default270x233.png,分析化学##指数##杀虫剂##毒理学,toxicity 即相对毒力指数。 标准药剂多为一般常用药剂。,,
DDT,http://www.baike.com/wiki/DDT,http://a1.att.hudong.com/52/00/50200009239445155864009641675_s.jpg,,DDT又叫滴滴涕，二二三，化学名为双对氯苯基三氯乙烷(Dichlorodiphenyltrichloroethane)，化学式(ClC₆H₄)₂CH(CCl₃)，是有机氯类杀虫剂。中文名称从英文缩写DDT而来，为白色晶体，不溶于水，溶于煤油，可制成乳剂，是有效的杀虫剂。为20世纪上半叶防止农业病虫害，减轻疟疾伤寒等蚊蝇传播的疾病危害起到了不小的作用。但由于其对环境污染过于严重，目前很多国家和地区已经禁止使用。世界卫生组织于2002年宣布，重新启用DDT用于控制蚊子的繁殖以及预防疟疾，登革热，黄热病等在世界范围的卷土重来。,中文名称：##外文名：##别名：##化学式：##CAS号：##摩尔质量：##外观：##密度：##熔点：##沸点：##溶解度（水）：##闪点：##缩写：,"滴滴涕##2,2-bis(4-Chlorophenyl)-1,1,1-trichloroethane##2,2-双(4-氯苯基)-1,1,1-三氯乙烷##C14H9Cl5##50-29-3##354.5##白色结晶状固体或淡黄色粉末##1.55(25℃ )##108～109##260##难溶##72##DDT"
地虫威,http://www.baike.com/wiki/地虫威,//www.huimg.cn/entry/images/summary_default270x233.png,农业##农药##农资流通##有机化学##杀虫剂##药剂学,地虫威为无色晶体，熔点69～75℃。在水中溶解度1.3g/L，易溶于丙酮、氯仿中。内吸性触杀、胃毒剂，兼有杀线虫作用，主要以拌种或处理土壤施用，防治地下害虫，线虫及苗期害虫。制剂有颗粒剂、可湿性粉剂等。,,
虫螨畏,http://www.baike.com/wiki/虫螨畏,//www.huimg.cn/entry/images/summary_default270x233.png,农药##农药名##化学品##杀虫剂##生物化学##科学##自然科学##药物,虫螨畏（methacrifos）纯品为无色液体。沸点90℃(1.3Pa)。微溶于水(400mg/L)，可与苯、乙醇等混溶。LD50 678mg/kg。,,
都灭,http://www.baike.com/wiki/都灭,//www.huimg.cn/entry/images/summary_default270x233.png,杀虫剂,都灭，即美国富美实公司（FMC）都灭5%悬浮剂是一种高效、广谱的拟除虫菊酯类杀虫剂，环境卫生杀虫剂，专为控制卫生害虫开发，保护环境卫生表现卓越。其主要成份为α-氯氰菊酯：一种高效、广谱拟除虫菊酯。,中文名：##成份：##优点：##颜色：##气味：##化学结构式：,都灭##主要成份为α-氯氰菊酯##剂型先进，确保更好药效等##乳白色##基本无味##活性成分的化学结构式
啶虫脒可溶性粉剂,http://www.baike.com/wiki/啶虫脒可溶性粉剂,//www.huimg.cn/entry/images/summary_default270x233.png,农药##杀虫剂,用药量 施用方法 蚜虫,,
碘硫磷,http://www.baike.com/wiki/碘硫磷,//www.huimg.cn/entry/images/summary_default270x233.png,农业##农药##农药名##化学##杀虫剂##科学##自然科学,碘硫磷属于化学物质，分子质量：413.0。,,
毒藜碱,http://www.baike.com/wiki/毒藜碱,//www.huimg.cn/entry/images/summary_default270x233.png,有机化学##杀虫剂##生物化学##生物学##生物碱,an 又称新烟碱。 可作杀虫剂。,,
地虫磷,http://www.baike.com/wiki/地虫磷,http://a3.att.hudong.com/12/37/50200009239445155661379728908_s.jpg,农药名##化工##有机化学##杀虫剂##物理化学##生物学##科学##自然科学,地虫磷产品为白色固体，沸点105～115℃(107Pa)。水中溶解度为1mg/L，可溶于乙醇、氯仿、二甲苯中。LD501～10mg/kg。一种有机磷杀虫剂，淡黄色液体，在水中的溶解度为13mg/L（25℃），可与煤油、己酮、二甲苯混溶。剂型为颗粒剂。毒性分级是剧毒。急性毒性为口服-大鼠 LD50: 3 毫克/公斤可燃性危险特性是明火可燃； 受热放出有毒氧化磷、氧化硫气体。储运特性为库房通风低温干燥； 与食品原料分开储运。灭火剂有砂土、干粉、泡沫。,,
大扶农,http://www.baike.com/wiki/大扶农,//www.huimg.cn/entry/images/summary_default270x233.png,农作物##农药##杀虫剂,大扶农；克百威；呋喃丹；2，3-二氢-2，2-二甲基-7-苯并呋喃基-N-甲基氨基甲酸酯,中文学名：##别名：##界：##种：,大扶农##克百威；呋喃丹##植物界##大扶农
迪立斯,http://www.baike.com/wiki/迪立斯,//www.huimg.cn/entry/images/summary_default270x233.png,农业##农药##杀虫剂,迪立斯毒死蜱微囊悬浮剂是一种新型高效、安全的杀虫剂，具有触杀、胃毒和熏蒸作用，适用于花生、水稻、小麦、棉花、果树、蔬菜、茶树上多种咀嚼式和刺吸式口器害虫，也可用于防治城市卫生害虫。,,
毒死蜱稻丰散,http://www.baike.com/wiki/毒死蜱稻丰散,http://a2.att.hudong.com/13/60/20300001075617138450602968485_s.jpg,杀虫剂,农药产品毒死蜱稻丰散是一种高效杀虫剂，是杀虫剂复配剂中比较常见的，配比方式为：毒死蜱40% 稻丰散50%。经过中国农药第一网测试中本品农药残留较低，在使用过程中一般不能和碱性农药混用，一旦发生中毒要及时救治，以及在运输过程中也需要在注意若干问题。,中文名：,毒死蜱稻丰散
啶虫咪,http://www.baike.com/wiki/啶虫咪,http://a0.att.hudong.com/83/63/20300543863594154307630837956_s.jpg,农药##杀虫剂,啶虫脒为3%的啶虫脒乳油，是一种新型杀虫剂。作为一种新型的杀虫剂，除了具有触杀和胃毒作用之外，还具有较强的渗透作用，且显示出速效的杀虫力，持效期长可达20天左右。本品对人畜低毒，对天敌杀伤力小，对鱼毒性较低，对蜜蜂影响小，适用于防治果树、蔬菜等多种作物上的半翅目害虫；用颗粒剂作土壤处理，可防治地下害虫。,中文名称：##外文名：##化学式：##分子量：##CAS登录号：##熔点：##密度：##闪点：##包装规格：##规格型号：,啶虫咪##Acetamiprid##C10H11ClN4##222.674##160430-64-8##100-102°C##1.2±0.1 g/cm3##166.9±30.7 °C##25KG##99%
二嗪磷,http://www.baike.com/wiki/二嗪磷,http://a4.att.hudong.com/56/92/50200009239445155330924823670_s.jpg,农业##农药名##化工##杀虫剂##生物化学##科学##自然科学,二嗪磷是一种农药的名称，主要防治菜青虫、棉蚜、三化螟和地下害虫。,中文名称：##外文名：##别称：##化学式：##分子量：##CAS登录号：##沸点：##水溶性：##密度：##外观：##应用：##危险性描述：,二嗪磷##Diazinon##二嗪农，地亚农##C12H21N2O3PS##304##333-41-5##83~84℃##60mg/L##1.11##黄色液体##农药##中毒
二氯炔戊菊酯,http://www.baike.com/wiki/二氯炔戊菊酯,http://a3.att.hudong.com/23/56/20300544005835149655565192345_s.jpg,化学##化工##杀虫剂,二氯炔戊菊酯是一种化学品，英文名是chlorempenthrin，本品为淡黄色至棕黄色油状液体或白色至淡黄色粉末状固体。,,
氟氯苯菊酯,http://www.baike.com/wiki/氟氯苯菊酯,http://a4.att.hudong.com/10/61/20300544048234149667614617037_s.jpg,农药##农药名##化合物##化学##化学品##杀虫剂##材料##科学##自然科学,"氟氯苯菊酯，中文别名：92%氟氯苯菊酯原药;α-氰基-4-氟-3-苯氧基苄基-3-(β,4-二氯苯乙烯基)-2,2-二甲基环丙烷羧酸酯;",中文名称：##外文名：##化学式：##CAS号：##摩尔质量：,氟氯苯菊酯##Flumethrin##C28H22Cl2FNO3##69770-45-2##510.38
恶虫酮,http://www.baike.com/wiki/恶虫酮,//www.huimg.cn/entry/images/summary_default270x233.png,农业##农药##农药名##化学品##杀虫剂##科学##自然科学##药剂,恶虫酮，农药名，纯品外观为无色结晶固体，无味，对昆虫有胃毒、触杀作用，主要用作卫生杀虫剂防治家蝇、蟑螂等，对蚜虫、飞虱、叶蝉等农业害虫亦有效。,,
氟氰胺菊酯,http://www.baike.com/wiki/氟氰胺菊酯,//www.huimg.cn/entry/images/summary_default270x233.png,农业##农药##工业##有机化学##杀虫剂,tau－fluvalin 分子量：502.9 蒸气压：大于0.013mPa(25℃),,
二氧化苊,http://www.baike.com/wiki/二氧化苊,//www.huimg.cn/entry/images/summary_default270x233.png,中间体##化工染料##杀虫剂,二氧化苊，也叫二氢苊醌、萘并乙二酮，英文名称：Acenaphthenequinone，黄绿色针状结晶，不溶于水，溶于乙醇、热苯及热甲苯。用作染料及杀虫剂的中间体。,,
防腐杀虫剂,http://www.baike.com/wiki/防腐杀虫剂,//www.huimg.cn/entry/images/summary_default270x233.png,杀虫剂##防腐剂,防腐杀虫剂，食品添加剂之一，是一类以保持食品原有性质和营养价值为目的的食品添加剂。,,
氟氰菊酯,http://www.baike.com/wiki/氟氰菊酯,//www.huimg.cn/entry/images/summary_default270x233.png,农业##农药##化学##有机化合物##杀虫剂##自然科学,氟氰菊酯为暗琥珀色粘稠液，属拟除虫菊酯类仿生物农药。,,
果圣杀虫剂,http://www.baike.com/wiki/果圣杀虫剂,http://a3.att.hudong.com/46/47/01200000146595134443473259505_s.jpg,农药##农资流通##杀虫剂,果圣杀虫剂果圣（0.5%烟·参碱水剂）是用苦参、烟草等杀虫植物经反复筛选和药效试验，用先进的萃取工艺而制成的一种广谱杀虫杀螨剂。 1、药剂配方合理，生产工艺先进，不含有机溶剂和乳化剂，使用后不污染环境。 2、制剂含量低，所需原材料少，毒性中等，生产中能耗少。,,
高渗麻醉剂,http://www.baike.com/wiki/高渗麻醉剂,//www.huimg.cn/entry/images/summary_default270x233.png,杀虫剂,高渗麻醉剂可分为油基型、水基型和粉剂三种形态，分别适用于不同的农药种类类型，尤其是油基型容易挥发，该品种必须溶于苯、醇后方可保持高渗·麻醉两大功效，不适合用于可湿性粉剂、可溶性粉剂、水分散粒剂等，适用范围详见列表：,,
庚虫磷,http://www.baike.com/wiki/庚虫磷,//www.huimg.cn/entry/images/summary_default270x233.png,农药##农资流通##化学品##杀虫剂##生物化学##药物,纯化合物为浅琥珀色液体，沸点64℃(100Pa)。 水中溶约2g/L，易溶于常用有机溶剂。 制剂有乳油、可湿性粉剂。,,
恶虫威,http://www.baike.com/wiki/恶虫威,//www.huimg.cn/entry/images/summary_default270x233.png,农业##农药##农药名##化学品##杀虫剂##科学##自然科学##药剂,恶虫威（bendiocarb），杀虫剂，纯品为白色固体。熔点128～130℃。在水中溶解度0.04g/L，易溶于丙酮、二甲基亚砜。,,
氟虫胺,http://www.baike.com/wiki/氟虫胺,//www.huimg.cn/entry/images/summary_default270x233.png,农药名##化学品##杀虫剂##生物化学##生物学##科学##自然科学##药物,"氟虫胺是一种化学物质，分子式是C10H6F17NO2S。中文别名：N-乙基全氟辛基磺酰胺;N-乙基全氟辛烷磺酰胺;N-乙基-1,1,2,2,3,3,4,4,5,5,6,6,7,7,8,8,8-十七氟代-1-辛烷磺酰胺;直链-N-乙基全氟辛烷磺酰胺;N-乙基全氟正辛磺酰胺;FC-9",中文名称：,氟虫胺
高丙体六六六,http://www.baike.com/wiki/高丙体六六六,//www.huimg.cn/entry/images/summary_default270x233.png,农药##化学##化学品##化工##杀虫剂##科技,"六六六有7种异构体分别称为：α-六六六、β-六六六、γ-六六六、δ-六六六、ε-六六六、η-六六六、θ-六六六，另有一对旋光异构体。其中α-、β-、γ-、δ-六六六又被称为甲体、乙体、丙体和丁体六六六。高丙体六六六又名γ-六氯环己烷，是γ异构体含量达到90%的六六六杀虫剂。其含量在99%以上的称“林丹”。由六六六工业原粉经溶剂萃取和结晶而成。 由于γ异构体六六六具有强杀虫力,且较易降解,因而杀虫用量减少,半衰期缩短,大大降低了六六六杀虫剂的环境残留和污染。",中文名称：##别称：##分子量：##熔点：##水溶性：##外观：,高丙体六六六##γ-六氯环己烷##290.83##112.5##不溶于水，溶于甲醇、乙醇、四氯化碳、石油醚、煤油和柴油等##白色粉末结晶。
环烷酸皂,http://www.baike.com/wiki/环烷酸皂,//www.huimg.cn/entry/images/summary_default270x233.png,化学工程##工业##杀虫剂##材料##防腐剂,"环烷酸皂根据结合的金属不同具有不同的特性颜色。是环烷酸金属盐类的统称。由环烷酸钠水溶液与相应的金属盐水溶液复分解反应制取。大多数溶解于苯、甲苯、松节油、松香水等有机溶剂。环烷酸钴、锰、铅盐对涂料、漆膜具有催干作用。铜、锌盐具有杀虫、灭菌作用,用作杀虫剂、船底涂料毒剂及木材之防腐剂。",,
好年冬,http://www.baike.com/wiki/好年冬,http://a0.att.hudong.com/85/78/20200000013920144727789053448_s.jpg,农药##农资流通##杀虫剂,好年冬又叫丁硫克百威、好年冬、安棉特，是克百威低毒化品种之一。,中文名称：##外文名：##别称：##化学式：##分子量：##沸点：##密度：,好年冬##carbosulfan##好安威##C20H32N2O3S##380.5##124～128##相对密度1.056（20℃）
甘蔗条螟性引诱剂,http://www.baike.com/wiki/甘蔗条螟性引诱剂,http://a4.att.hudong.com/47/38/01300000227401123250382646051_s.jpg,杀虫剂##生物化学##生物学##科学##自然科学##药剂,甘蔗条螟性引诱剂（sex pheromone of sugarcane leafhopper），甘蔗条螟性引诱剂是人工合成的模仿条螟雌雄蛾交配信息联系的化学物质。从甘蔗条螟雌蛾体内分离到的性信息素，为顺式-十六碳-11-烯基乙酸酯、顺式-十八碳-13-烯醇和顺式-十八碳-13-烯基乙酸酯的混合物(4:1:5)。现已化学合成。用于防治甘蔗条螟和预测预报。,,
甘氟,http://www.baike.com/wiki/甘氟,//www.huimg.cn/entry/images/summary_default270x233.png,农药##应用科学##有机化学##杀虫剂##毒物##科学##药品##药物中文名称列表,甘氟(glyftor) 甘氟是一种醇类有机化合物，为无色或微黄色透明油状液体，略有酸味，易和水、醇、乙醚混溶。化学性质稳定，但暴露在空气中易挥发，是一种植物内吸性药剂，在植物体内能保留20—30天。具有选择性毒力，潜伏期一般2—3小时，鼠食毒饵后多死于24小时以内，也有长达72小时者。属极毒，二次中毒的危险性比氟乙酰胺和氟乙酸钠(国家已明令禁用)小。鸡和鸭对甘氟有很大的耐受力。,中文名：,甘氟
