title,url,image,openTypeList,detail,baseInfoKeyList,baseInfoValueList
香椿紫纹羽病,http://www.baike.com/wiki/香椿紫纹羽病,http://a0.att.hudong.com/64/01/20300543547369144706010332051_s.jpg,植物##病虫害,香椿紫纹羽病，病菌在土壤中的病根上越冬。春季土壤潮湿时开始侵入嫩根，夏季在根内表生成一层紫色菌丝层，使根皮腐烂。地势低洼，种植过密、雨水较多的条件下，发病尤重。,,
西葫芦褐色腐败病,http://www.baike.com/wiki/西葫芦褐色腐败病,//www.huimg.cn/entry/images/summary_default270x233.png,病虫害##蔬菜,叶片染病，多形成水渍状暗绿色大斑，湿度高时病部腐烂。 叶柄受害亦呈水渍状软腐，病部表面产生稀疏白霉。 2、合理浇水，避免大水漫灌，雨后及时排水，适当增施钾肥，发现病瓜及时清除。,,
香椿干枯病,http://www.baike.com/wiki/香椿干枯病,http://a0.att.hudong.com/65/06/20300543547369144689066098978_s.jpg,植物##病虫害,香椿干枯病多发生于幼树主干，首先树皮上出现梭形水渍状湿腐病斑，继而扩大，呈不规则状。发病时用70%甲托布津2000倍液喷洒，或在病斑处打孔，深达木质部，涂抹10%碱水或氯化锌甘油合剂。,,
小白菜细菌性叶斑病,http://www.baike.com/wiki/小白菜细菌性叶斑病,http://a2.att.hudong.com/25/71/20300001385827140106718307458_s.jpg,植物##病虫害,小白菜细菌性叶斑病，真菌，危害部位小白菜叶片。,中文名：,小白菜细菌性叶斑病
西葫芦镰孢霉果腐病,http://www.baike.com/wiki/西葫芦镰孢霉果腐病,http://a3.att.hudong.com/77/66/20300543534928144670666498475_s.jpg,植物##病虫害,西葫芦镰孢霉果腐病，是一种危害瓜果的病毒。常从花蒂部位或受伤处侵染，病部初期呈水渍状，以后变褐软腐，后期在病部表面产生白色至粉红色霉状物，最后病瓜完全腐烂。,,
西葫芦猝倒病,http://www.baike.com/wiki/西葫芦猝倒病,//www.huimg.cn/entry/images/summary_default270x233.png,病虫害##蔬菜,"为害症状/西葫芦猝倒病 编辑


			
		　　该病是苗期主要病害之一。种芽感病，苗未出土，种芽或胚茎、子叶已腐烂；幼苗受害，近土面的胚茎基部开始有黄色水渍状病斑，随后变为黄褐色，干枯收缩成线状，子叶尚未凋萎，幼苗已猝倒。有时带病幼苗外观与健苗无异，但贴服土面，不能挺立，细检此苗，茎基部已干缩成线状。此病在苗床内蔓延迅速，开始只见个别病苗，几天后便出现成片猝倒。当苗床湿度大时，病部表面及其附近土表可长出一层白色棉絮状菌丝体。幼苗发病初期茎基部出现水浸状病斑，病斑很快变黄褐色。以后病斑缢缩使茎基部变成细线状，严重时，子叶凋落。幼苗出现大片死亡。湿度大时病部腐烂，幼苗附近长出白色棉絮状菌丝。 
 发病规律/西葫芦猝倒病 编辑


			
		　　病菌以卵孢子在土壤中越冬。条件适宜萌发产生游动孢子囊，孢子囊释放游动孢子或直接长出芽管侵染幼苗。病菌也可以菌丝体在病残体或在土壤内腐殖质上腐生生活，菌丝形成游动孢子囊，释放游动孢子侵染幼苗。病菌主要通过浇水或管理传播，带菌粪肥和操作工具也可传播。病菌侵染后在皮层薄壁细胞中扩展，以后在病部产生孢子囊，进行再侵染，最后在病组织内产生卵孢子越冬。土壤温度15～16℃病菌繁殖很快，土壤高湿极易诱发此病。浇水后苗床积水或苗床棚顶滴水处多为发病中心。光照不足，幼苗长势弱，或育苗期遇寒流或连阴雨、雪天气，低温潮湿，病害发生严重。 发病的适宜地温为10℃，病菌生长适温为15～16℃，低温高湿下易发病。早春育苗期遇阴雨、下雪、密播以及棚膜滴水等均易发病。 
 防治方法/西葫芦猝倒病 编辑


			
		 　　育苗床采用地势高燥，排水良好，保温性强的温床，用营养钵育苗，为幼苗创造良好的生长条件，增强幼苗的抗菌能力。床土药剂处理：每平方米苗床用50%的拌菌双粉剂7克，或40%五氯硝基苯粉剂9克，总细干土5千克拌匀制成药土。先浇足底水，水下渗后取1/3药土撒在畦面上，播种后将其余2/3药土覆盖种子上。 　　苗床底水要浇足，出苗后尽量不浇水。分苗水严禁明水大浇。苗床地温保持在15℃以上。幼苗发病初期可薄撒一层药土。 预防：    A、将奥力克——青枯立克按600倍液稀释，每平米3升在播种前或播种后及栽前苗床浇灌。    B、在定植时或定植后和预期病害常发期前，将本产品按600倍液稀释，进行灌根，每7天用药1次，用药次数视病情而定。    治疗：    A、稀释倍数：按奥力克——青枯立克500倍液稀释使用，病害严重时，可适当加大用药量。    B、用药方法：对病株及病株周围2～3米内植株进行灌根或小面积漫灌；若病原菌同时为害地上部分，应在根部灌药的同时，地上部分同时进行喷雾，每5天用药1次。    用药原则：    跟据“土壤干湿度及植株大小”决定灌药量的多少，以“彻底灌透作物扎根范围”为目的，一般每株灌液100—400ml。",,
徐州市农业科学院甘薯病虫害防控研究室,http://www.baike.com/wiki/徐州市农业科学院甘薯病虫害防控研究室,//www.huimg.cn/entry/images/summary_default270x233.png,农业##徐州##病虫害,序号项目类型项目名称主持或参加1江苏省高技术课题能源作物新品种选育（甘薯和菊芋） 主持2农业部行业计划甘薯标准化栽培技术研究 主持3农业部“948”甘薯病毒病检测新技术的引进及病毒病普查,,
小白菜立枯病,http://www.baike.com/wiki/小白菜立枯病,http://a2.att.hudong.com/03/16/20300542898581144613166316836_s.jpg,植物##病虫害,小白菜立枯病主要特征有幼苗发病，幼茎中下部变褐缢缩，植株干枯后死亡。发病苗能引起株基腐。该病为真菌性病害，病原菌为立枯丝核菌。病原菌在土壤中越冬，地温高于10℃时进入腐生阶段，病原菌从根部飞散，还可通过雨水、灌溉水、肥料或种子传播蔓延。,,
西葫芦细菌性叶斑病,http://www.baike.com/wiki/西葫芦细菌性叶斑病,http://a3.att.hudong.com/78/66/20300001385827140132665354601_s.jpg,植物##病虫害,西葫芦细菌性叶斑病，病菌在土壤中存活能力非常有限，主要通过种子带菌传播蔓延。此病在我国东北、内蒙古均有发生，保护地常比露地发病重。,,
西瓜病毒病,http://www.baike.com/wiki/西瓜病毒病,http://a0.att.hudong.com/13/12/50200014992522154400129584052_s.jpg,农业##农业气象百科##植物病理学##病虫害,西瓜病毒病，俗称小叶病、花叶病，全国各地区均有发生，北方瓜区以花叶型病毒病为主，南方瓜区蕨叶型病毒病发生较普遍，尤以秋西瓜受害最重。危害程度的轻重与种子带菌率和蚜虫发生数量密切相关。西瓜受害后，叶片变小，生长缓慢，植株矮化，花器发育不良，严重的不能座果，或座果后发育不良，畸形，果小，产量低，品质差，失去商品价值。,中文名：##别 名：,西瓜病毒病##小叶病、花叶病
香芹菜软腐病,http://www.baike.com/wiki/香芹菜软腐病,//www.huimg.cn/entry/images/summary_default270x233.png,病虫害,病原中文名： 病原拉丁学名： 病害类型：,,
西瓜蚜虫,http://www.baike.com/wiki/西瓜蚜虫,//www.huimg.cn/entry/images/summary_default270x233.png,农业科学##病虫害##西瓜,西瓜蚜虫以成虫及若虫群集在瓜的嫩叶背面和嫩茎上吸食汁液。瓜苗嫩叶及生长点被害后，叶片卷缩，瓜苗萎蔫，甚至枯死。老叶受害不卷曲，但提前枯落，造成减产。蚜虫还传播病毒病，引起西瓜病毒病的大量发生。,中文名：,西瓜蚜虫
西葫芦细菌性软腐病,http://www.baike.com/wiki/西葫芦细菌性软腐病,http://a1.att.hudong.com/25/06/50200009239445156017061570103_s.jpg,病害##病虫害,西葫芦细菌性软腐病是棚室西葫芦的重要病害，常造成棚室西葫芦大面积的死亡，造成减收，甚至绝产。,,
芫荽细菌疫病,http://www.baike.com/wiki/芫荽细菌疫病,http://a4.att.hudong.com/46/78/01200000127668134435787988337_s.jpg,病虫害,Corian 病原中文名： 病害类型：,,
玉米甜菜夜蛾,http://www.baike.com/wiki/玉米甜菜夜蛾,//www.huimg.cn/entry/images/summary_default270x233.png,玉米##病虫害,玉米甜菜夜蛾--学名：Spodoptera exigua Huner ，属鳞翅目，夜蛾科。,,
叶斑病,http://www.baike.com/wiki/叶斑病,http://a3.att.hudong.com/14/28/50200009239445155970289885918_s.jpg,健康##农业气象百科##森林灾害##森林病害##生活##疾病##病症##病虫害,叶斑病是甜瓜重要病害之一，分布较广，各地都有发生，一般在春、秋两季发生较重。发病率10%～60%，严重地块或棚室达100%，可减产10%～30%，特别严重时可减产60%以上。此病还可为害黄瓜、冬瓜、丝瓜、苦瓜等蔬菜。,中文名：##病原分类地位：##主要危害作物：##发病率：,叶斑病##假单胞杆菌##甜瓜##10%～60%
柚子裂皮病,http://www.baike.com/wiki/柚子裂皮病,//www.huimg.cn/entry/images/summary_default270x233.png,病虫害,病原类别 称为柑桔裂皮病类病毒。 该病毒对以枳橙、莱檬作砧木的果树为害严重。,,
玉米褐斑病,http://www.baike.com/wiki/玉米褐斑病,http://a0.att.hudong.com/57/60/50200009239445155331605932045_s.jpg,农业##玉米##病虫害,玉米褐斑病是近年来在我国发生严重且较快的一种玉米病害。该病害在全国各玉米产区均有发生，其中在河北、山东、河南、安徽、江苏等省危害较重。该病主要发生在玉米叶片、叶鞘及茎秆上。先在顶部叶片的尖端发生，最初为黄褐色或红褐色小斑点，病斑呈圆形或椭圆形，严重时叶片上全部布满病斑，在叶鞘上和叶脉上出现较大的褐色斑点，发病后期叶片的病斑处呈干枯状。,中文名：##别名：##病原类型：##主要危害作物：##主要为害部位：,玉米褐斑病##玉米褐斑病菌##真菌##玉米##位 叶片、叶鞘及茎秆
柚子衰退病,http://www.baike.com/wiki/柚子衰退病,//www.huimg.cn/entry/images/summary_default270x233.png,病虫害,"柚子衰退病是一种病毒，在我国及广东分布相当普遍，对甜橙等植物危害极大。病原体长2000mm-3000nm，宽10nm-20nm,呈弯曲线状，内含单链RNA。",,
油菜假黑斑病,http://www.baike.com/wiki/油菜假黑斑病,http://a4.att.hudong.com/06/66/01200000166843134441663334485_s.jpg,农作物##病虫害##蔬菜,altern (2)施用日本酵素菌沤制的堆肥或采用猪粪堆肥，培养拮抗菌，加强田间管理，提高油菜抗病力和耐病性。 (4)种子消毒，可用种子重量0.4%的50%扑海因可湿性粉剂或75%百菌清可湿性粉剂拌种。,中文学名：,油菜假黑斑病
洋葱球茎腐烂病,http://www.baike.com/wiki/洋葱球茎腐烂病,http://a4.att.hudong.com/72/29/01200000212198134439297575835_s.jpg,农业##病虫害,洋葱球茎腐烂病中文名： 病原中文名： 病原拉丁学名：,,
玉米青枯病,http://www.baike.com/wiki/玉米青枯病,http://a1.att.hudong.com/30/19/50200009239445155547193925372_s.jpg,农业##病虫害,玉米青枯病又称玉米茎基腐病或茎腐病，是世界性的玉米病害，但在我国近年来才有严重发生。1981年河南省大发生，全省被害面积100万亩以上，严重地块发病率达80%-90%，甚至绝产；1985年河北省涿鹿县发病面积在10万亩以上，每亩减产50-100公斤；1987年吉林省怀德、榆树、扶余 等县，因此病减产达0．75亿公斤；1988年广西省扶绥县，秋玉米上大发生，面积达7万-8万亩，发病率为70%-80%，损失严重。,中文名：##别名：##类型：##发病率：##发病地区：##发病部位：,玉米青枯病##玉米茎基腐病或茎腐病##土传真菌病害##10%~20%##西部、西南、东北、华北##玉米根和茎基部
蚜青灵,http://www.baike.com/wiki/蚜青灵,//www.huimg.cn/entry/images/summary_default270x233.png,农业##农药##园艺##病虫害,蚜青灵又名菊乐合酯。蚜青灵是氰戊菊酯与乐果等药物混配，采用气相色谱和薄层溴量法反复试验出的新型杀虫剂。,,
叶枯灵,http://www.baike.com/wiki/叶枯灵,//www.huimg.cn/entry/images/summary_default270x233.png,农业##农药##农药名##园艺##病虫害##科学##自然科学,药剂特性叶枯灵有保护和内吸治疗作用。在碱性条件下不稳定。对人畜有中等毒性，对鱼类安全。,中文名：,叶枯灵
月季白轮蚧,http://www.baike.com/wiki/月季白轮蚧,//www.huimg.cn/entry/images/summary_default270x233.png,病虫害,雌成虫介壳觅，椭圆形或近圆形，直径2—2.4毫米，白色；蜕皮在边缘，深褐色。 雄虫体瘦长，捅红色，前翅1对，无色透明，触角茧色，丝状，足3对。 初龄若虫棍红色，扁平，卵圆形，后期橙黄色，圆形，触角缩短。,,
月季花叶病,http://www.baike.com/wiki/月季花叶病,//www.huimg.cn/entry/images/summary_default270x233.png,病虫害,病原菌： 月季花叶病毒 发病规律：,,
杨褐斑病,http://www.baike.com/wiki/杨褐斑病,http://a1.att.hudong.com/61/26/01200000028518136359269290463_s.jpg,植物##病虫害,杨褐斑病，又名黑斑病，是杨树的主要病害之一。引起杨褐斑病的病原为半知菌亚门中盘二孢属的杨盘二孢菌Marssonina populi (Lib.) Magn.和褐斑盘二孢M. Brunnea(Ell. Et Ev.) Sacc.。病菌以菌丝体在病落叶或病枝梢中越冬，翌年春季产生分生孢子作为初侵染来源。杨褐斑病能为害多种杨树，如小叶杨、小青杨、加杨、毛白杨等，但河南省以加杨受害最重。,,
杨桃蛀果蛾,http://www.baike.com/wiki/杨桃蛀果蛾,//www.huimg.cn/entry/images/summary_default270x233.png,农业科学##水果种类##病虫害,"为害特点 /杨桃蛀果蛾 编辑


			
		杨桃蛀果蛾幼虫只为害果实，小幼虫蛀果后，蛀孔溢出水珠状汁液，干涸呈白色膜痕。幼虫在果内串食果肉，幼果期受害果变畸形。幼虫将粪便排在果内，失去食用价值。[1] 
  生活习性 /杨桃蛀果蛾 编辑


			
		 中国北方年发生1～2代，6～7月间成虫大量羽化，7～8月为第1代幼虫为害期。8月下旬幼虫老熟,结茧化蛹，8～10月初发生第2代。 
  形态特征 /杨桃蛀果蛾 编辑


			
		  　茶翅蝽成虫体长15毫米左右、宽8～9毫米。体扁椭圆形。灰褐色，略带紫红色。触角5节，第2节比第3节长，第4节两端和第5节基部黄色。胸背和前翅布满黑褐色刻点。卵似杯状，灰白色。20～30粒排列成卵块。若虫体略成扁圆形，黑褐色，背部有黑斑。黄斑蝽成虫体长20～30毫米，宽8～11毫米。灰褐色，体背和前翅密生许多黄色斑点。触角黑色。卵横径1．8毫米，圆筒形。淡黄白色。12粒聚成一团。若虫初龄胸、腹有许多红、黄、黑相间的横纹。2龄体灰黑色，腹部背面有6个红黄色斑点。 
 防治方法 /杨桃蛀果蛾 编辑


			
		　　(1)出土期防治 　　5月下旬在果园设置桃蛀果蛾性诱剂诱捕器。当开始诱捕到成虫时，在树冠下喷洒25％对硫磷微胶囊剂，每亩0．5公斤加水300倍药液。或40％甲基异柳磷乳油，每亩0．3公斤加水300倍。半月以后喷第二遍。 　　幼虫出上始期也可喷洒昆虫寄生线虫-一芜菁夜蛾线虫。每平方米施入线虫60～80万条。施线虫一次相当施用两次农药的效果。施线虫前如土壤水分不足，应先灌水后施线虫。 　　(2)树上喷药防治 　　利用性诱剂测报，在成虫发生始盛期，大体在6月下旬，喷布40％水胺硫磷乳油1500倍液，杀蛀果的初孵幼虫，有效控制期可达一月之久。此时喷布水胺硫磷并可兼治叶螨。防治桃蛀果蛾也可使用50％对硫磷乳油1500倍液，10天后喷第2遍。8月上旬和下旬第二、三代卵盛期，喷布50％杀螟硫磷乳油1500倍、20％氰戊菊酯3000倍或灭幼脲3号500～1000倍液。8月份喷药防治，根据卵果率l％的防治指标，因品种施药，既减少施药面积，也有利于保护果园的自然天敌。",,
杨梅毛虫,http://www.baike.com/wiki/杨梅毛虫,//www.huimg.cn/entry/images/summary_default270x233.png,病虫害,梅毛虫一年发生1代。幼虫于4月上旬孵化，头部呈黑褐色，有微细白毛，，第三和第四节背上各有一点黑色隆起，体两侧各有黄色横纹1条。,中文学名：,杨梅毛虫
杨树根癌病,http://www.baike.com/wiki/杨树根癌病,http://a1.att.hudong.com/65/59/50200009239445156020597341720_s.jpg,植物##病虫害,杨树根癌病是一种主要发生在幼苗期的病害。该病在中国分布广，危害较重，主要危害苗木和幼树，新移栽的苗木更易发生，轻则影响生长，重则造成大面积的树木枯死。该病主要发生在幼树的根颈处，有时主根、侧根以及地上部的主干也发生。该病的病原是薄壁菌门中的根癌土壤杆菌。毛白杨、加杨、大青杨均可受害，以毛白杨的幼树受害最重，病株率可达5~10%。用生防菌剂K84的菌悬液浸杨树的插条或根再栽植可大大降低肿瘤的数目及肿瘤的大小，防效高达90%左右。,,
芫荽花叶病毒病,http://www.baike.com/wiki/芫荽花叶病毒病,//www.huimg.cn/entry/images/summary_default270x233.png,农业##病虫害,CMV见姜花叶病毒病；PVY病毒粒体弯曲，长杆状，质粒大小11×730纳米，致死温度52～62℃，稀释限点100～1000倍，体外存活期2～3天。 蚜虫是花叶病毒病帮凶，首先用20%菊马乳油1000倍液，或21%灭杀毙乳油4000倍液，或10%吡虫啉可湿性粉剂3000倍液，或25%唑蚜威可湿性粉剂2000倍液每667平方米喷50～60kg防治蚜虫，采前7天停止用药。 病毒病发病初期用5%菌毒清500倍液加20%病毒A水溶性粉剂500倍液每667平方米喷50～60kg，10天1次，连喷2次，采前3天停用药。,,
油桐八星天牛,http://www.baike.com/wiki/油桐八星天牛,http://a2.att.hudong.com/28/66/50200009239445156007665383327_s.jpg,病虫害,油桐八星天牛，Batocera davidis Deynolle，为鞘翅目天牛科白条天牛属的一种昆虫。分布在河南、陕西、湖南、江西、重庆、四川、贵州、云南、广东、福建、台湾等地。 幼虫在韧皮部蛀食，虫道不规则，并逐渐深入木质部为害。成虫羽化后补充营养，啃食1年生的枝条皮。被害树木生长衰弱，使果实早期脱落，甚至枯死。,,
杨树紫纹羽病,http://www.baike.com/wiki/杨树紫纹羽病,http://a0.att.hudong.com/48/26/01200000184371136359269060380_s.jpg,植物##病虫害,杨树紫纹羽病，又称紫色根腐病，分布较广泛，河南省郑州、民权、睢县都曾发现报道。该病常见于苗圃或积水林地，苗木受害后很快会枯死，成年树受害树势逐渐衰弱，严重时也会死亡。该病病原为担子菌亚门的紫卷担子菌Helicobasidium purpureum (Tul.) Pat.，病菌以菌丝体和菌核的形式在病根上存活，菌核抵抗不良环境的能力强，在土壤中长期存活，以后萌发侵染寄主。,,
洋葱球茎软腐病,http://www.baike.com/wiki/洋葱球茎软腐病,http://a3.att.hudong.com/13/72/20300001385827134088720528110_s.jpg,农业##农业科学##植物##病害##病虫害,洋葱球茎软腐病主要为害球茎和叶片，球茎染病球茎内部鳞片腐烂，从外部不容易发现，发病后期整个球茎变软，且有大量细菌。叶片染病多在叶部产生坏死斑。,中文名：,洋葱球茎软腐病
浙江黑松叶蜂,http://www.baike.com/wiki/浙江黑松叶蜂,http://a3.att.hudong.com/16/78/50200009239445156004785381341_s.jpg,昆虫##病虫害##膜翅目,昆虫名，为膜翅目，叶蜂科。布于浙江（杭州）、广西（合浦、柳州、博白、上思）、广东（广州）、湖北（安陆）、江西、（南昌）、云南（昆明）、四川（西昌）。 为害五针松、湿地松、黑松及马尾松等，幼虫为害期分别为5－6月、7－8月、9－11月。幼虫为害严重时可使松针参差不齐，或仅留基部，影响树势和正常生长。,中文学名：##拉丁学名：##界：##门：##纲：##目：##科：##分布区域：,浙江黑松叶蜂##Nesodiprion zhejangensis zhou et xiao##动物界##节肢动物门 Arthropoda##昆虫纲 Isecta##膜翅目##叶蜂科##浙江、广西、广东、湖北、江西、云南、四川。
早疫病,http://www.baike.com/wiki/早疫病,http://a0.att.hudong.com/44/97/20300543373111144828975211535_s.jpg,农业##病虫害##自然科学,属真菌病害，苗期、成株期均可发病，苗期发病，幼苗的茎基部生暗褐色病斑，稍陷，有轮纹。成株期发病一般从下部叶片向上部发展。初期叶片呈水渍状暗绿色病斑，扩大后呈圆形或不规则轮纹斑，边缘具有浅绿色或黄色晕环。中部具同心轮纹，潮湿时病部长出黑色霉层·主要症状是病部有（同心）轮纹。,中文名：##预防措施：##病菌生长适温：##特 点：,早疫病####26～28℃##高温高湿发病重
竹蚜虫,http://www.baike.com/wiki/竹蚜虫,http://a2.att.hudong.com/10/89/50200009239445156003896663557_s.jpg,病虫害,竹蚜虫属于同翅目，蚜科。有四种，即竹后粗腿蚜（新种）、竹色蚜、竹梢凸唇斑蚜和矢竹斑蚜。浙江省临安市森林防护站首先对竹蚜的发生规律和生物学特性进行了研究。竹蚜虫在新竹抽枝展叶时为害最严重，其他各月份都有为害。该虫群集于新枝、嫩叶上吸食液汁，并导致产生煤污病，严重影响竹子生长，使竹笋产量大幅度下降。,中文学名：##界：##门：##亚门：##纲：##亚纲：##目：##亚目：##科：,竹蚜虫##动物界##节肢动物门Arthropoda##六足亚门##昆虫纲 Insecta##有翅亚纲##同翅目##胸喙亚目##蚜科
玉米锈病,http://www.baike.com/wiki/玉米锈病,http://a4.att.hudong.com/81/14/50200009239445155965140061778_s.jpg,农业气象百科##玉米##病虫害##粮食,玉米锈病是我国华南、西南一带重要病害。主要侵染叶片，严重时也可侵染果穗、苞叶乃至雄花。 病原称玉米柄锈，属担子菌亚门真菌。夏孢子堆黄褐色。夏孢子浅褐色，椭圆形至亚球状，具细刺。,中文名：##病原中文名：##病原类型：##主要危害作物：##主要为害部位：,玉米锈病##玉米柄锈##担子菌亚门真菌##玉米##主要侵染叶片
药用植物害虫马尾松毛虫,http://www.baike.com/wiki/药用植物害虫马尾松毛虫,//www.huimg.cn/entry/images/summary_default270x233.png,害虫##生物学##病虫害,形态特征成虫体长20一35mm，雌蛾翅展48—80mm；雄蛾38—62mm，体色有黄褐、灰褐、棕褐、茶褐色等多种，体色变化较大。 幼虫期34—56天，以末龄幼虫在松针丛中、树皮下、灌木杂草上结茧化蛹，蛹期11—22天。 (7)于成虫产卵初期，每667m2释放赤眼蜂10万头，进行生物防治。,,
樟叶瘤丛螟,http://www.baike.com/wiki/樟叶瘤丛螟,http://a2.att.hudong.com/58/46/01200000223202134428468703538_s.jpg,病虫害,成虫体长8~13mm，翅展22~30mm。 1代幼虫孵出为害，7月下旬幼虫老熟化蛹，蛹期10~15天。 月虫巢中均有不同龄期幼虫为害，10月老熟幼虫陆续下树入土结茧越冬。,,
药用植物害虫榆毒蛾,http://www.baike.com/wiki/药用植物害虫榆毒蛾,//www.huimg.cn/entry/images/summary_default270x233.png,生物学##病虫害,末龄幼虫体长约25—35mm，体浅黄绿色，头灰褐色。 蛹长15mm，浅绿色，头顶具黑褐色毛束。 7月中、下旬进入1代幼虫孵化盛期，8月下旬化蛹。,,
紫荆枯萎病,http://www.baike.com/wiki/紫荆枯萎病,http://a4.att.hudong.com/08/93/20300001203200130278931497342_s.jpg,农业##植物##植物保护##病害##病虫害,紫荆又名满条红，其树姿优美，叶形秀丽，花朵别致。为常见的早春花木。紫荆枯萎病是病虫害的。,,
中西除虫菊酯,http://www.baike.com/wiki/中西除虫菊酯,//www.huimg.cn/entry/images/summary_default270x233.png,农业##农药##园艺##病虫害,中西除虫菊酯又名戊菊酯、中西菊酯、杀虫菊酯等，是一种新型的拟除虫菊酯类杀虫剂。以触杀作用为主，兼有胃毒、拒避作用。,,
枣尺蠖,http://www.baike.com/wiki/枣尺蠖,http://a2.att.hoodong.com/13/85/01300000190300121660850202301_s.jpg,害虫##病虫害,枣尺蠖为鳞翅目、尺蛾科。在我国枣产区普遍发生，北方枣区受害较严重。,中文学名：##别名：##拉丁学名：##界：##门：,枣尺蠖##枣步曲##Chihuo zao Yang##动物界##节肢动物门
