title,url,image,openTypeList,detail,baseInfoKeyList,baseInfoValueList
花生早衰症,http://www.baike.com/wiki/花生早衰症,//www.huimg.cn/entry/images/summary_default270x233.png,传媒##农业##农学##教育##病害##知识,花生早衰症严重影响花生产量，是花生后期管理中应解决的重要问题，通常是由于后期脱肥，导致叶片黄化，光合作用减弱，叶片不能维持较长的功能期；病虫危害，如叶斑病、根茎腐病、红蜘蛛等，造成叶片大面积坏死，叶片脱落；旱涝灾害，造成根系活性减弱，地上部生长受阻；植株旺长等原因引起花生早衰症状。,,
花生冠腐病,http://www.baike.com/wiki/花生冠腐病,http://a2.att.hudong.com/42/18/50200009239445156374186243402_s.jpg,农学##病害,花生冠腐病是针对花生全株的一种真菌型病害，病原称黑曲霉，属半知菌亚门真菌。该病害多在苗期发生，侵染子叶与胚轴接合部，使子叶变黑腐烂。该病害可以通过田间整理或者药剂喷洒来防治。,中文名：##别名：##病原中文名：##病原拉丁学名：##病原分类地位：##病原类型：##主要危害作物：##主要为害部位：,花生冠腐病##黑霉病、曲霉病##黑曲霉##Aspergillus niger van Tiegh．##半知菌亚门##真菌##花生##全株
葫芦霜霉病,http://www.baike.com/wiki/葫芦霜霉病,//www.huimg.cn/entry/images/summary_default270x233.png,病毒,葫芦霜霉病主要为害叶片。叶片染病初生黄绿色斑点，扩展后变为浅褐色，受叶脉限制呈多角形，病情扩展后相互融合成不规则形大病斑，致叶片变黄褐色干枯。湿度大时，叶背可见灰色至紫黑色霉状物，即病原菌分生孢子梗和分生孢子。别于瓠瓜细菌性褐斑病。该病为害较重。,,
胡萝卜黑斑病,http://www.baike.com/wiki/胡萝卜黑斑病,http://a3.att.hudong.com/74/20/50200009239445155998200479183_s.jpg,农业##病害,胡萝卜黑斑病属半知菌亚门真菌。有子座或无；分生孢子梗生于叶片两面，单生或分枝，褐色，1—7根成束伸出，大小24～44×6～7.2微米；分生孢子串生，长卵形，深褐色，大小30～96×14～28微米，具纵横10多个，横隔4～10个。,,
瓠瓜炭疽病,http://www.baike.com/wiki/瓠瓜炭疽病,http://a1.att.hudong.com/51/74/20300000009075133890748345615_s.jpg,传媒##农业##农学##教育##生物##病害##知识##自然,幼苗子叶边缘发生褐色半圆形或圆形病斑，茎基部缢缩，幼苗猝倒。成株叶、茎、果均可被害，叶片上病斑圆形、黄褐色，外围常有黄色晕圈，后期病斑中央常破裂或脱落。西瓜叶片病斑圆形至不规则形，黑褐色，外围有黑色晕圈，有时出现同心轮纹，扩大后常互相汇合，引起叶片早枯。,中文学名：##界：##门：##亚门：##纲：##目：##科：,葫芦科刺盘孢##真菌界##真菌门##半知菌亚门##半知菌纲##盘菌目##盘菌科
黄瓜菌核病,http://www.baike.com/wiki/黄瓜菌核病,http://a1.att.hudong.com/84/82/50200009239445155963824256686_s.jpg,传媒##农业##农学##教育##生物##病害##知识##自然,苗期至成株期均可发病，以距地面5-30厘米发病最多，瓜被害脐部形成水浸状病斑，软腐，表面长满棉絮状菌丝体。茎部被害，开始产生退色水浸状病斑，逐渐扩大呈淡褐色，病茎软腐；长出白色棉絮状菌丝体，茎表皮和髓腔内形成坚硬菌核，植株枯萎。幼苗发病时在近地面幼茎基部出现水浸状病斑，很快病斑绕茎一周，幼苗猝倒。一定湿度和温度下，病部先生成白色菌核，老熟后为黑色鼠粪状颗粒。,中文名：##病原中文名：##病原类型：##主要危害作物：##传播途径：,黄瓜菌核病##核盘菌##细菌##黄瓜##随种子远距离传播
禾草麦角病,http://www.baike.com/wiki/禾草麦角病,http://a0.att.hudong.com/73/67/20300000723751133853679346616_s.jpg,病害,禾草麦角病是多种禾本科作物及牧草的重要病害。此病不仅使牧草种子减产，而且所产生的菌核（麦角）含有多种具剧毒的生物碱。人、畜食入相当数量后，重者可以急性死亡，轻者引起流涎、麻痹、昏睡、四肢及耳壳木乃伊化干枯脱落。,,
瓠子枯萎病,http://www.baike.com/wiki/瓠子枯萎病,http://a3.att.hudong.com/22/54/50200009239445156378540450473_s.jpg,传媒##农业##教育##病害##知识,瓠子枯萎病，俗称“死秧子”，一般年份发生较轻，个别年份发生较重。一般重茬或多年连作发病较重。,中文名：,瓠子枯萎病
黄瓜靶斑病,http://www.baike.com/wiki/黄瓜靶斑病,http://a0.att.hudong.com/47/82/50200009239445155959821857027_s.jpg,病害,黄瓜靶斑病是由黄瓜靶斑病菌——半知菌的棒孢菌引起的病害，温暖、高湿有利于发病。俗称小黄点病。,中文名：##别名：##发病部位：##常见病因：##传染性：,黄瓜靶斑病##黄瓜靶斑病##叶片##半知菌的棒孢菌##有
黄瓜绿斑花叶病,http://www.baike.com/wiki/黄瓜绿斑花叶病,http://a3.att.hudong.com/78/80/01200000032655134377803601732_s.jpg,农业##植物##病害##细菌,黄瓜绿斑花叶病是一种土壤和种子为初侵染源的病害，其发病条件较宽，增加了防治的难度。除黄瓜外，葫芦、西瓜、甜瓜等瓜类也发生此病。,,
黄栌白粉病,http://www.baike.com/wiki/黄栌白粉病,//www.huimg.cn/entry/images/summary_default270x233.png,病害,黄栌白粉病是危害黄栌的主要病害之一，该病主要发生于在北京、山东、河北、河南、陕西、四川等地，其中北京、西安的黄栌发病最严重。病菌以闭囊壳在病落叶和病枝上越冬．或以菌丝在病枝上越冬。翌年夏初闭囊壳吸水开裂放出子囊孢子，菌丝体直接产生分生孢子进行初传染，生长季节以分生孢子进行再传染。 在北京，6月底至7月初发病，8～9月份，为发病盛期；一般树冠下部叶片以及地面根际萌蘖小枝先发病，树势衰弱时病重。植株密度大，通风不良发病重；生长在山顶的树比生长在窝风的山谷中的树发病轻；黄栌生长不良发病重；分蘖多的树发病重。受白粉病危害可导致叶片干枯或提早脱落。,,
红地球葡萄日灼病,http://www.baike.com/wiki/红地球葡萄日灼病,http://a4.att.hudong.com/13/29/50200009239445155825294086140_s.jpg,农业##园艺##病害,红地球葡萄日灼病是一种非侵染性生理病害。幼果膨大期强光照射和温度剧变是其发生的主要原因。果穗在缺少阴蔽的情况下，受高温、空气干燥与阳光的强辐射作用，果粒幼嫩的表皮组织水分失衡发生灼伤。,,
桧胶锈病,http://www.baike.com/wiki/桧胶锈病,//www.huimg.cn/entry/images/summary_default270x233.png,病害,iperus ian ian,,
黄瓜朱砂叶螨,http://www.baike.com/wiki/黄瓜朱砂叶螨,http://a2.att.hudong.com/67/76/50200009239445156003768445888_s.jpg,病害,黄瓜朱砂叶螨是一种广泛分布于世界温带的农林大害虫，在我国各地均有发生。朱砂叶螨的寄主很多，已知有110多种植物，在蔬菜上主要为害豆类、茄子、黄瓜等，也为害番茄、辣椒、马铃薯、瓜类；除此外也是棉花、月季、茉莉、玉米等植株上的重要害虫。虫体集聚成桔红至鲜红色的虫堆为害叶片。被害叶片上出现许多细小白点，导致失绿枯死，叶背有蜘蛛吐丝结网。主要在夏、秋季或高温干旱地区（棚室）发生。,,
胡萝卜黑腐病,http://www.baike.com/wiki/胡萝卜黑腐病,//www.huimg.cn/entry/images/summary_default270x233.png,农业##病害,真菌引起的病害。 （2）实行2年轮作。 （3）增施基肥和追肥。,,
胡椒叶斑病,http://www.baike.com/wiki/胡椒叶斑病,//www.huimg.cn/entry/images/summary_default270x233.png,农业##园艺##病害,胡椒叶斑病是胡椒树易得的一种疾病，以叶片初期出现小黄斑，继而变褐色，圆形，直径1cm，后期病斑变灰白色，具黄色边缘为主要症状，可以喷射50％多菌灵1000倍液治疗。,,
胡椒白绢病,http://www.baike.com/wiki/胡椒白绢病,//www.huimg.cn/entry/images/summary_default270x233.png,病害,学名为Marasmius scandens，病叶变褐、干枯，由白色菌体联结悬挂在植株上。,,
胡椒水害,http://www.baike.com/wiki/胡椒水害,http://a1.att.hudong.com/47/95/20300001309101131570956364276_s.jpg,病害,胡椒因水分过多导致叶片失去光泽，顶部枝条停止生长，继而嫩叶、嫩枝脱落，根系腐烂的灾害。,,
黄锈病,http://www.baike.com/wiki/黄锈病,http://a0.att.hudong.com/84/44/50200009239445155811443633517_s.jpg,农业##植物##病害,黄锈病，植物的一种病害。症状是叶片上和茎上出现成条的黄色斑点，病株子粒不饱满，小麦易得此病。也叫黄疸。,中文名：##别名：##病原中文名：##病原拉丁学名：##病原类型：##主要危害作物：##主要为害部位：##拼音：##病害：,黄锈病##黑顶柄锈，屈恩柄锈菌##甘蔗黄锈病##Puccinia kuehnii Butl##担子菌亚门的黑顶柄锈或屈恩柄锈菌##松树、圆柏、月季、玫瑰、贴梗海棠、毛白杨、黄杨等##叶片、芽、嫩枝等##huáng xiù bìng##真菌性
黄芪白粉病,http://www.baike.com/wiki/黄芪白粉病,http://a2.att.hudong.com/10/35/20300001385827133894353623740_s.jpg,病害##药材,黄芪白粉病主要为害叶片，也可为害茎和荚果。叶面最初产生近圆形白色粉状斑，扩展后连接成片，呈边缘不明显的大片白粉区，上面布满白色粉末状霉层，严重时叶背及整株被白粉覆盖。后期白粉呈灰白色，霉层中产生无数黑色小颗粒，造成叶片枯黄早落，影响产量。病原菌病原为豌豆白粉菌（Erysiphe Pisi DC.），属子囊菌亚门，白粉菌属真菌。,,
胡椒枯萎病,http://www.baike.com/wiki/胡椒枯萎病,http://a3.att.hudong.com/51/95/50200009239445155570955680681_s.jpg,病害,胡椒枯萎病，印度和巴西报道本病原是腐皮镰孢菌[Fusarium solani（Mart.）App. et Woll.]；有的认为是根结线虫（Meloidogyne spp.）或穿孔线虫（Radopholus similis）；也有说是镰刀菌和线虫复合侵染所致等。,,
红豆草刺盘孢炭疽病,http://www.baike.com/wiki/红豆草刺盘孢炭疽病,http://a4.att.hudong.com/02/47/20300000822820133888472781830_s.jpg,植物##病害,红豆草刺盘孢炭疽病，由半知菌亚门刺盘孢菌属真菌侵染引起，主要要为害幼苗的茎和成株的茎、叶片、叶柄和根颈，也侵染花序和种子。是红豆草等植物的重要病害，全国各种植区广泛发生，严重影响牧草产量和品质。,,
胡椒炭疽病,http://www.baike.com/wiki/胡椒炭疽病,//www.huimg.cn/entry/images/summary_default270x233.png,病害,胡椒炭疽病，多发生在老叶的叶尖和叶缘上的灰褐色病斑，使病叶脱落，通过加强椒园抚育管理和化学方法来防治。,,
胡椒线疫病,http://www.baike.com/wiki/胡椒线疫病,//www.huimg.cn/entry/images/summary_default270x233.png,病害,在胡椒生长发育的各个时期，有近50种病原物参与为害胡椒，包括真菌、细菌、病毒、线虫和藻类。根据1992年华南五省区热带作物病虫害调查结果，我国胡椒有31种病害，其中主要病害有胡椒疽病、胡椒细菌性叶斑病、胡椒花叶病、胡椒枯萎病、胡椒根结线虫病，次要病害有炭瘟病、根腐病（红根腐病、褐根腐病、紫根腐病）、菌核病、藻斑病等。,,
胡椒花叶病,http://www.baike.com/wiki/胡椒花叶病,//www.huimg.cn/entry/images/summary_default270x233.png,病害,"胡椒花叶病，为黄瓜叶病毒,用40％乐果1000倍液喷杀蚜虫，可以控制病害传播。",,
胡椒根结线虫病,http://www.baike.com/wiki/胡椒根结线虫病,//www.huimg.cn/entry/images/summary_default270x233.png,病害,胡椒根结线虫病使根瘤初期乳白色，后变淡褐色或深褐色，最后呈现暗黑色。雨季根瘤腐烂，旱季根瘤干枯开裂。病株生长停滞，节间变短，叶色淡黄，落花落果，甚至整株死亡。,,
胡椒细菌性叶斑病,http://www.baike.com/wiki/胡椒细菌性叶斑病,//www.huimg.cn/entry/images/summary_default270x233.png,病害,介绍关于胡椒细菌性叶斑病的病害简介、为害症状以及防治方法。,,
胡椒菌核病,http://www.baike.com/wiki/胡椒菌核病,//www.huimg.cn/entry/images/summary_default270x233.png,病害,胡椒枯萎病又名慢性萎蔫病、慢性衰退病、黄化病，是仅次于胡椒瘟病的一种重要病害。,,
灰雪霉病,http://www.baike.com/wiki/灰雪霉病,http://a3.att.hudong.com/80/70/50200009239445155661705926242_s.jpg,农业##植物##植物保护##病害,灰雪霉病在北半球的北方，积雪停留时间长的地区是一个重要病害。在积雪长达3个月或更长，且不融化，该病更为重要。它可能与粉红雪霉病联合发生，但它的范围不会比粉红雪霉病更广。不像粉红雪霉病有无积雪覆盖物都会发病，灰雪霉病的发生要有覆盖物。通常有雪、叶片、草覆盖物和干燥覆盖物也适合。,,
胡椒瘟病,http://www.baike.com/wiki/胡椒瘟病,//www.huimg.cn/entry/images/summary_default270x233.png,病害,胡椒瘟病是4指以棕榈疫霉为病原的，有效地侵染胡椒的主蔓基部、各器官，致使整株胡椒枯死的一种病症。目前已有成熟的治疗办法。,,
黄瓜细菌性缘枯病,http://www.baike.com/wiki/黄瓜细菌性缘枯病,//www.huimg.cn/entry/images/summary_default270x233.png,农业##植物学##病害,方案一：《奥力克-细截》50ml+金贝40ml，兑水15公斤水，5—7天用药1次，连用2-3次； 方案二：《奥力克-细截》50ml+青枯立克30ml，兑水15公斤，每5—7天用药1次； 方案三：《奥力克-细截》50ml+速净30ml，兑水15公斤，,,
花生根腐病,http://www.baike.com/wiki/花生根腐病,http://a0.att.hudong.com/42/98/50200009239445155660989314927_s.jpg,农业##农学##病害##科学##自然科学,花生根腐病在花生各生育期皆可发生。花生播后出苗前染病，可引起烂种、烂芽。,中文名：##主要危害作物：,花生根腐病##烂种、烂芽
黄瓜黑斑病,http://www.baike.com/wiki/黄瓜黑斑病,http://a2.att.hudong.com/46/77/50200009239445156003778141623_s.jpg,农业##病害,中下部叶片先发病，后逐渐向上扩展，重病株除心叶外，均可染病。,,
黄瓜灰霉病,http://www.baike.com/wiki/黄瓜灰霉病,http://a4.att.hudong.com/27/82/50200009239445155959822515268_s.jpg,农业##植物##病害##自然##蔬菜,黄瓜灰霉病是黄瓜保护地栽培常年发生的一种病害，近年来发生呈逐年趋重。由于果实常常受到侵扰而引起腐烂。菜农常常称之烂果病，霉烂病。,中文名：##别名：##病原学：##传播途径：##并发症：,黄瓜灰霉病##真菌半知菌亚门灰葡萄孢##Botrytis cinerea##叶片、幼果、茎蔓、花蒂##真菌半知菌亚门
胡椒幼苗基腐病,http://www.baike.com/wiki/胡椒幼苗基腐病,//www.huimg.cn/entry/images/summary_default270x233.png,病害,胡椒幼苗基腐病是种植胡椒时感染的一种病毒性病，多可造成根茎部的腐烂。,,
胡椒藻斑病,http://www.baike.com/wiki/胡椒藻斑病,//www.huimg.cn/entry/images/summary_default270x233.png,病害,胡椒藻斑病的病菌为害叶、果、枝等器官。感病部位产生铁锈色小斑点，其上长出红锈色毛毡状物，防治方法为1%的波尔多液。,,
核桃腐烂病,http://www.baike.com/wiki/核桃腐烂病,http://a0.att.hudong.com/58/18/50200009239445155316189425964_s.jpg,病害,核桃腐烂病是一种真菌所致，在显微镜下，分生孢子器埋于木栓层下，多腔，形状不规则，黑褐色，有长颈。春秋两季为一年的发病高峰期，特别是在4月中旬至5月下旬危害最重。一般在核桃树管理粗放，土层瘠薄，排水不良，肥水不足，树势衰弱或遭受冻害及盐害的核桃树易感染此病。,,
花卉苗木立枯病,http://www.baike.com/wiki/花卉苗木立枯病,//www.huimg.cn/entry/images/summary_default270x233.png,农业##植物##植物保护##病害,"立枯病是由真菌侵染而引起的一种苗期病害，病菌多从表层土侵染幼苗根部和茎基部，受害部下陷缢缩,呈黑褐色。如幼苗刚出土时，表现病状为猝倒；如幼苗组织已木质化，则表现为立枯。潮湿时病部长白色菌丝体或粉红色霉层，严重时造成病苗萎蔫死亡。",,
桧柏锈病,http://www.baike.com/wiki/桧柏锈病,http://a4.att.hudong.com/81/45/50200009239445156002454331385_s.jpg,农业##植物##植物保护##病害,桧柏锈病是一种与苹果、梨树、海棠等转主寄生的病害。在我国普遍发生，除对桧柏造成危害外，还直接导致多种果树受害、减产。梨胶锈菌以多年生菌丝体在桧柏病部组织中越冬。病菌侵入桧柏后，10至12月出现症状，呈黄色小斑。至第二年二三月间，症状才明显，冬孢子角突破寄主表皮而外露。3月下旬以后冬孢子才逐渐成熟。气温在5℃以上时，冬孢子角遇雨即胶化，冬孢子萌发黄粉状的担孢子，它不能危害桧柏，只能危害转主寄主如梨树等，而在转主寄主上形成的性孢子和锈孢子不能再危害梨树等，转而侵害桧柏的嫩叶或新梢，形成新的侵染循环。,,
胡椒肥害,http://www.baike.com/wiki/胡椒肥害,//www.huimg.cn/entry/images/summary_default270x233.png,病害,胡椒肥害防治农业措施：①定植前施的基肥要腐熟透，干净细碎，混匀；②幼苗追肥时，要勤施，淡施，不要干施。,,
茴香根腐病,http://www.baike.com/wiki/茴香根腐病,http://a2.att.hoodong.com/21/31/01300000190300121513313673114_s.jpg,农业##病害,茴香根腐病引起幼苗萎蔫死亡，根及根茎部变褐色坏死腐烂。成株期发病，先是外部叶片萎蔫，以后全株萎蔫死亡；根茎部和根变色，发病初期多为红褐至黄褐色坏死，以后发展成褐色至黑褐色腐烂，容易拔起。空气潮湿时发病部位产生少量粉红色的霉状物。,中文名：,茴香根腐病
荷花褐纹病,http://www.baike.com/wiki/荷花褐纹病,http://a0.att.hudong.com/87/33/20300543582848144715339268215_s.jpg,农业##植物##植物保护##病害,荷花褐纹病又名荷花黑斑病。我国荷花栽培区常有发生。发病初期荷花叶上出现褪绿大黄斑，叶背更为明显。,,
花生青枯病,http://www.baike.com/wiki/花生青枯病,http://a2.att.hudong.com/40/44/50200009239445155331445342382_s.jpg,农业##农业气象百科##植物##病害##细菌,我国长江流域、山东、江苏等省发病重，河北、安徽、辽南偶有发生。是典型的维管束病害，从苗期到收获期均可发生，以花期最易发病。青枯细菌主要侵染根部，致主根根尖变色软腐，病菌从根部维管束向上扩展至植株顶端。横切病部呈环状排列的维管束变成深褐色，用手捏压时溢出浑浊的白色细菌脓液。初发病时早晨叶片张开延迟，傍晚提早闭合，主茎顶梢第一、二叶片先萎蔫，侧枝顶叶暗淡萎垂，1-2天后全株叶片急剧凋萎，但叶片仍呈青绿色别于其它枯萎病。,中文名：,花生青枯病
黑星病,http://www.baike.com/wiki/黑星病,http://a1.att.hudong.com/57/02/50200009239445155963025506911_s.jpg,农业气象百科##植物学##病害,黑星病是一种检疫性病害，除危害黄瓜外，还可危害西葫芦、甜瓜、南瓜等。我县近年来以温室大棚黄瓜发病较重，造成黄瓜减产。现将其病害发生规律及防治措施介绍如下。,中文名：##病原中文名：##病原拉丁学名：##病原分类地位：##病原类型：##主要危害作物：##主要为害部位：,黑星病##半知菌##Cladosporium cucumerinum##半知菌亚门（Deuteromycotina）##真菌##黄瓜，西葫芦，甜瓜，甜瓜，南瓜##叶片、果实、茎蔓
黄瓜根结线虫病,http://www.baike.com/wiki/黄瓜根结线虫病,http://a3.att.hudong.com/27/03/50200009239445155964030790208_s.jpg,农业##病害,黄瓜根结线虫病发生后，植株叶片暗淡无光，不久萎蔫、枯萎死亡，容易与枯萎病混淆。近年来，在保护地栽培中由于长年连作，黄瓜根结线虫病发生日趋严重，应引起密切注意。它还可以危害番茄、茄子、萝卜等多种蔬菜作物。,中文名：,黄瓜根结线虫病
花生根结线虫病,http://www.baike.com/wiki/花生根结线虫病,http://a2.att.hudong.com/40/47/20300543140711149525475548846_s.jpg,农业##农学##病害##科学##自然科学,简介,中文名：,花生根结线虫病
黑麦秆锈病,http://www.baike.com/wiki/黑麦秆锈病,http://a4.att.hoodong.com/73/87/01000000000000119088765958073_s.jpg,农业##农学##病害##科学##自然科学,"黑麦秆锈病：症状：主要为害茎秆、叶鞘，也侵害叶片和穗部。病部产生长椭圆形、铁锈色夏孢子堆，多先发生于叶背，散生，发病严重时愈合成长条形。成熟散出大量锈褐色粉末(夏孢子)。生长后期形成黑色冬孢子堆。 病原；Puccinia graminis var. secalis Eriks et Henn.称禾柄锈菌黑麦变种，属担子菌亚门真菌。形态特征 参见小麦秆锈病。 传播途径和发病条件 该菌在黑麦、大麦、冰草等植物上产生夏孢子、冬孢子，在小檗和十大功劳属植物上产生锈孢子和性孢子。但病菌在南方以夏孢子世代在麦苗上越冬，春季借风雨传播为害。发病适宜温度18—25℃，潜育期7—14天。雨量多、叶面潮湿、施氮过多有利于发病。
 防治方法：(1)选用抗病的黑麦品种。(2)药剂防治参见小麦秆锈病。",,
荷兰豆炭疽病,http://www.baike.com/wiki/荷兰豆炭疽病,http://a3.att.hudong.com/85/22/20300576608360158018225535933_s.jpg,病害,荷兰豆炭疽病是一种主要危害荷兰豆茎部的真菌性植物疾病，主要症状是茎染病，病斑近梭形或椭圆形，边缘暗褐色略凹陷。,中文名：##中 央：##主要为害：##直 径：##危害作物：##主要症状：,荷兰豆炭疽病##浅褐色##茎##2～4毫米##荷兰豆##茎染病
黄瓜猝倒病,http://www.baike.com/wiki/黄瓜猝倒病,http://a4.att.hudong.com/07/78/50200009239445155364781642145_s.jpg,农业##农业气象百科##病害,黄瓜猝倒病，俗称“卡脖子”、“小脚瘟”、“掉苗”等，是冬春季黄瓜苗期常发病害之一。,病原中文名：##病原拉丁学名：##病原分类地位：##病原类型：##主要为害部位：,德里腐霉##Bythium deliense Meurs．##鞭毛菌亚门##真菌##根部
黄瓜细菌性角斑病,http://www.baike.com/wiki/黄瓜细菌性角斑病,http://a1.att.hudong.com/52/72/01300000190300121504728257076_s.jpg,农业##病害,黄瓜细菌性角斑病是黄瓜上的重要病害之一。常在田间与黄瓜霜霉病混合发生，病斑比较接近，有时容易混淆，但黄瓜霜霉病发病初期在叶片背面产生几个多角形水渍状病斑，而细菌性角斑病在叶片背面产生针状水渍状病斑，往往几十个病斑同时发生。病情发生趋势没有霜霉病迅速，对黄瓜生长影响没有霜霉病严重。,中文名：##病原中文名：##主要危害作物：##防治技术：,黄瓜细菌性角斑病##丁香假单胞杆菌黄瓜角斑病致病型##黄瓜##选用耐病品种
花生斑驳毒病,http://www.baike.com/wiki/花生斑驳毒病,//www.huimg.cn/entry/images/summary_default270x233.png,病害,病原花生斑驳毒病的毒原还没最后定论。 发病规律：花生斑驳毒病主要以种子带毒。 花生斑驳毒病发病轻重与种子带毒率的高低有密切关系。,,
合欢树蔷薇窄吉丁,http://www.baike.com/wiki/合欢树蔷薇窄吉丁,http://a0.att.hudong.com/25/24/20300542214570138214249580432_s.jpg,农业##病害,一种危害合欢树的害虫，其幼虫喜食合欢枝干皮层，使得被害处出现流脓流胶现象。该虫一年一代，喜阳光，十一月上旬停止危害，休眠越冬。治疗方法为：在4月幼虫开始活动时，涂上煤油敌敌畏液。,,
红脚绿金龟,http://www.baike.com/wiki/红脚绿金龟,http://a4.att.hudong.com/75/23/01300536469226137607238955760_s.jpg,害虫##昆虫##生物学##病害,红脚绿金龟，节肢动物门，分布于广东、广西、福建等地。,中文学名：##界：##门：##纲：##亚纲：##目：,红脚绿金龟##动物界##节肢动物门##昆虫纲##有翅亚纲##鞘翅目
黄瓜黑星病,http://www.baike.com/wiki/黄瓜黑星病,http://a3.att.hudong.com/66/81/50200009239445155959818738840_s.jpg,农业##植物##病害##自然##蔬菜,分类地位 ：半知菌亚门（Deuteromycotina）丝孢纲（Hyphomycetes）丝孢目（Hyphomycetales）黑色菌科（Dematiaceae）枝孢属（Cladosporium） et Arthur，称瓜疮痂枝孢菌，属半知菌亚门真菌。菌丝灰绿色，具分隔。分生孢子梗由菌丝分化而成，单生或丛生，褐色或淡褐色，顶部、中部稍有分枝或单枝，顶生分生孢子。分生卵形、不规则形、褐色或橄榄绿色，单或串生，单胞、双胞，少数3胞。,中文名：##外文名：##染病时期：##传播条件：,黄瓜黑星病##Scab of cucurbits##分为幼苗、嫩茎、卷须、叶片##雨水、气流和农事操作在田间传播
