title,url,image,openTypeList,detail,baseInfoKeyList,baseInfoValueList
矮丰一号,http://www.baike.com/wiki/矮丰一号,http://a2.att.hudong.com/42/35/50200009239445155503351653175_s.jpg,农业##小麦##种子,超高产、超大穗、高抗倒伏小麦新品种 矮丰一号,中文学名：,矮丰一号
北农9549,http://www.baike.com/wiki/北农9549,//www.huimg.cn/entry/images/summary_default270x233.png,农作物##小麦,北农9549是一种植物。冬性，中熟，成熟期比对照京冬8号晚2天。幼苗半匍匐，生长健壮，植株繁茂，分蘖力中等。株高83厘米，抗倒伏能力强。穗纺锤型，长芒，白壳，白粒，籽粒角质。成穗率中等，平均亩穗数40万穗，穗粒数28粒，千粒重45克。越冬百分率84.3％，抗寒性比对照京冬8号（越冬率96％）差。,中文学名：,北农9549
北麦7号,http://www.baike.com/wiki/北麦7号,//www.huimg.cn/entry/images/summary_default270x233.png,农作物##小麦##生物##种子##自然,北麦7号，春性，晚熟，生育期93天左右。幼苗直立，苗期发育较快，繁茂。株高100厘米左右。穗纺锤型，长芒，红粒，角质。平均亩穗数38.4万穗，穗粒数35.6粒，千粒重32.4克。抗倒性较好，熟相较好。适宜在东北春麦区的黑龙江北部、内蒙古呼伦贝尔市地区种植。,中文学名：##界：##门：##纲：##目：##科：##属：##种：##品种：,北麦7号##植物界##被子植物##单子叶植物##禾本目##禾本科##小麦属##普通小麦##北麦7号
北麦3号,http://www.baike.com/wiki/北麦3号,//www.huimg.cn/entry/images/summary_default270x233.png,农作物##小麦##生物##种子##自然,北麦3号，晚熟小麦品种，由黑龙江省农垦总局九三科学研究所选育。,中文学名：##界：##门：##亚门：##纲：##科：##属：##种：##品种：,北麦3号##植物界##种子植物门##被子植物亚门##单子叶植物纲##禾本科##小麦属##普通小麦##北麦3号
矮抗58,http://www.baike.com/wiki/矮抗58,http://a3.att.hudong.com/51/25/50200009239445155959252551164_s.jpg,小麦##种子,百农矮抗58是由河南科技学院小麦育种中心用周麦11x温麦6号X郑州8960选育而成的小麦品种，2003年开始开发经营的划时代小麦新品种。,中文学名：##别名：##界：##体征：##选育单位：##审定编号：##原名：,矮抗58##百农矮抗58##植物界##株高70cm左右，高抗倒伏，饱满度好。产量三要素协调，亩成穗45万左右，穗粒数38－40粒，千粒重4##河南科技学院##国审麦2005008##百农矮抗58
巴麦11号,http://www.baike.com/wiki/巴麦11号,//www.huimg.cn/entry/images/summary_default270x233.png,农业##农作物##小麦##生物##种子##自然,巴麦11号，以巴97-8360为母本，1608、96-4870、91L鉴37为父本，采用多亲本聚合杂交选育而成。,中文学名：##别名：##界：##门：##纲：##目：##科：##属：##种：##亚种：,巴麦11号##巴麦11号小麦##植物界##被子植物门(Angiospermae)##单子叶植物纲(Monocotyledoneae)##禾本目(Poales)##禾本科(Poaceae；Gramineae)##小麦属(Triticum)##小麦##巴麦11号
北农66,http://www.baike.com/wiki/北农66,//www.huimg.cn/entry/images/summary_default270x233.png,农业##小麦##种子,冬性，中熟。幼苗半直立，叶片灰绿色，分蘖力、成穗率中等。穗纺锤型，长芒，白壳，白粒。株高75～80厘米，株型较繁茂。每亩成穗42万，穗粒数30粒，千粒重42克左右。抗倒性较好。抗病性、抗寒性中等。品质中筋偏上。经农业部谷物品质监督检验测试中心检验，2001年，粗蛋白含量14.45%，湿面筋含量32.8%，干面筋含量10.6%，沉降值34.8mL，面团形成时间3.4分钟，稳定时间5.0分钟，面包体积780cm3 （面包重量158g），综合评分88.0；2002年，粗蛋白含量 14.13%，湿面筋含量32.3%，干面筋含量10.8%，沉降值32.2mL，面团形成时间3.4分钟，面团稳定时间3.2分钟。,,
北京841,http://www.baike.com/wiki/北京841,http://a0.att.hudong.com/03/02/50200009239445155862026784835_s.jpg,农业##农作物##小麦##植物##自然,北京841原代号CA841，组合为北京18号/丰抗4号//农大139，1992年8月，通过北京市农作物品种审定委员会审定，同年通过山西省农作物品种审定委员会认定，1996年6月，通过全国农作物品种审定委员会审定。北京841适宜于北京、天津、冀中、冀东、晋中、晋东南等地区中等至中上等肥力麦田种植。,中文学名：##界：##门：##亚门：##纲：##目：##科：##属：##种：##分布区域：##性情：##体征：##千粒重：##原代号：##审定时间：##株高：,北京841##植物界##种子植物门##被子植物亚门##单子叶植物纲##禾本目##禾本科##小麦属##小麦##北京、天津、冀中、冀东、晋中##冬性，中晚熟##短芒、白壳、白粒，穗大粒大##45克以上##CA841##1992年##95厘米左右
百农160,http://www.baike.com/wiki/百农160,http://a2.att.hudong.com/61/54/50200009239445156291542586146_s.jpg,农业##小麦##水稻,百农160,中文学名：,百农160
安麦7号,http://www.baike.com/wiki/安麦7号,http://a0.att.hudong.com/78/23/20300000822820132022237732082_s.jpg,农业##农作物##农资流通##小麦##种子,安顺市农科所于1992年用外引品系三属麦与8625杂交后，采用系谱法，经多代自交于2000年选育而成。,中文学名：##品种：##审定编号：##品种类别：##品种来源：,安麦7号##安97-12##黔审麦2008004号##小麦##安顺市农科所
拔节,http://www.baike.com/wiki/拔节,http://a2.att.hudong.com/64/12/50200009239445155964126319884_s.jpg,农业##小麦,稻、麦、高粱、玉米等禾本科植物到一定发育阶段时，主茎的各节长得很快，叫做“拔节”。,中文名：##拼音：##注音：##高度：,拔节##bá jié##ㄅㄚˊ ㄐㄧㄝ##1.5—2.0厘米
赤麦5号,http://www.baike.com/wiki/赤麦5号,//www.huimg.cn/entry/images/summary_default270x233.png,农作物##小麦,特征特性：春性，生育期90天左右，比对照品种辽春9号早1天，属中早熟品种。幼苗直立，叶片灰绿色。株高90厘米，穗纺缍型，长芒，白壳，红粒，籽粒硬质。平均亩穗数33万穗，穗粒数35粒，千粒重37克。抗旱性级别3级，抗旱性中等，与对照品种辽春9号相当。高抗条锈病，感叶锈病，中感白粉病。容重为798.5克/升，粗蛋白含量16.5%，湿面筋含量36.9%，沉降值33.6毫升，吸水率60.2%，面团稳定时间3.4分钟。,中文学名：,赤麦5号
长旱58,http://www.baike.com/wiki/长旱58,http://a2.att.hudong.com/61/54/50200009239445156291542586146_s.jpg,农作物##小麦##粮食,长旱58适应于海拔1000米左右的地区，适宜播期为9月底至10月初，其他海拔每降低或提高100米，播期推迟或提前2-3天。适宜播期范围内，亩播量9-10公斤，晚播和肥力差或过于干旱时适当增加播量。及时防治锈病、白粉病和蚜虫，在丰水年份防止倒伏。适时收获，防止穗发芽。,中文学名：##界：##分布区域：##体征：##审定编号：##选育单位：##品种来源：##特征特性：,长旱58##植物界##山西东南部、山东西南部、河南西北部、陕西渭北旱塬、河北东南部##株高72厘米，株型较松散，长相清秀，叶色黄绿，穗层整齐##国审麦2004015##陕西省长武县农业技术推广中心##长武112/PH82-2##半冬性
昌麦29,http://www.baike.com/wiki/昌麦29,//www.huimg.cn/entry/images/summary_default270x233.png,小麦,凉山州西昌农科所3531/1169春性中熟，全生育期182天左右，与对照川麦107相当。 两年区试平均亩产399.9公斤，比对照川麦107增产13.2%。 2008-2009年参加凉山州小麦生产试验，平均亩产402.8公斤，比对照川麦107增产14.2%，6个点全部增产。,,
测墒补灌,http://www.baike.com/wiki/测墒补灌,//www.huimg.cn/entry/images/summary_default270x233.png,小麦,"""以作物主要生育时期耕层土壤的含水量作为目标含水量",,
长麦6135,http://www.baike.com/wiki/长麦6135,http://a2.att.hudong.com/31/62/50200009239445155862620737751_s.jpg,农业##农作物##小麦##种子,长麦6135，为杂交小麦品种，其幼苗直立，芽鞘白色，叶色灰绿，叶耳紫色，叶片上冲，茎杆粗壮，分蘖能力强。株高70～80cm，叶片黄绿，无蜡质，穗层整齐，穗呈长方形，长芒，护颖卵形、斜肩、白色，颖嘴鸟嘴形，小穗密度中等，多花多实，结实性好，籽粒白色、角质、卵形，大小均匀，商品性好。亩穗数40～45万，穗粒数30粒左右，千粒重40～45克。分蘖能力强，成穗率高，落黄好，抗倒性较好，抗病性较好。比长4738晚熟1天。,中文学名：##株高：##类 型：##特 点：##品种来源：,长麦6135##70～80cm##杂交小麦品种##抗倒性较好，抗病性较好##山西省农业科学院谷子研究所
川麦32,http://www.baike.com/wiki/川麦32,//www.huimg.cn/entry/images/summary_default270x233.png,小麦,审定(登记)编号： 审定(登记)年份： 审定(登记)单位：,,
川麦58,http://www.baike.com/wiki/川麦58,http://a0.att.hudong.com/62/75/20300543938569148349756011245_s.jpg,农业##小麦##植物##种子,春性，全生育期178天左右。幼苗半直立，分蘖力较强。苗叶绿色，叶宽中等，叶耳绿色。植株较整齐，平均株高82厘米，穗方长型，长芒，白壳，成熟期早，白粒，半角-粉质，籽粒椭圆形、饱满。,,
长6154,http://www.baike.com/wiki/长6154,//www.huimg.cn/entry/images/summary_default270x233.png,农作物##小麦,长6154，是由山西省农科院谷子所 选育的麦子，具有中抗条锈病，中感白粉病和黄矮病，高感叶锈病和秆锈病特点。,中文学名：,长6154
陈洋尔,http://www.baike.com/wiki/陈洋尔,//www.huimg.cn/entry/images/summary_default270x233.png,小麦,Yuan Bioen Yuan,,
长6359,http://www.baike.com/wiki/长6359,http://a1.att.hudong.com/67/09/50200009239445155331099837253_s.jpg,小麦##植物,长6359是山西省农科院谷子研究所在承担国家“863”计划项目中，用82230-6做母本，94-5383做父本，后代采用水旱交叉选育法育成的小麦新品种。,,
CA9722,http://www.baike.com/wiki/CA9722,//www.huimg.cn/entry/images/summary_default270x233.png,农业##小麦##种子,CA9722品种来源，中国农业科学院作物育种栽培研究所，京411/贵农11//京411。,,
川农17号,http://www.baike.com/wiki/川农17号,//www.huimg.cn/entry/images/summary_default270x233.png,农作物##小麦,川农17号是四川农业大学于2002年审定登记的一个小麦品种。春性，早熟，是穗多兼穗大型品种，全生育期185天（比川麦28长3-7天）。2001年四川省区试平均亩产361.5公斤，比对照川麦28增产11.3%。适宜播期为11月1～8日，基本苗10～15万／亩，根据栽培水平，播种量为6～10公斤/亩，条、窝、机播均可。适宜四川省盆地麦区种植。,中文学名：,川农17号
川育14,http://www.baike.com/wiki/川育14,//www.huimg.cn/entry/images/summary_default270x233.png,农作物##小麦,"川育14是一种植物。春性，早熟，全生育期185天。幼苗半直立，分蘖力较强，株高90厘米。穗方形，长芒，白壳。籽粒卵圆形，红粒，半硬质，千粒重40克。蛋白质含量14.39%，湿面筋含量37%，沉降值29.7ml,吸水率63%，稳定时间3分钟，最大阻力370E.U。中抗条锈病、赤霉病，中感白粉病。",中文学名：,川育14
川麦36,http://www.baike.com/wiki/川麦36,//www.huimg.cn/entry/images/summary_default270x233.png,小麦##种子##粮食,川麦36是四川省农科院作物所和四川华丰种业有限责任公司通过与国际玉米小麦改良中心合作，最新选育而成的高产优质高抗白皮小麦新品种。,,
川农麦1号,http://www.baike.com/wiki/川农麦1号,//www.huimg.cn/entry/images/summary_default270x233.png,农作物##小麦,川农麦1号是四川农业大学 选育出来的新品种，主要特征是春性，早熟，生育期190天左右。幼苗半直立，分蘖力强，株高80cm，抗倒伏能力强。穗长方形，短芒，白壳。籽粒椭圆形，粒色淡红。适宜在长江中上游的湖北、四川、云南等省中上等水肥地种植，后期及时防治蚜虫危害。,中文学名：,川农麦1号
陈洪田,http://www.baike.com/wiki/陈洪田,//www.huimg.cn/entry/images/summary_default270x233.png,,陈洪田(1917—1985)，海宁长安褚石村人。出身贫农。1954年起从事农作物育种。二三十年间，育成麦、稻、油菜、黄麻等品种30多个。,,
川育20,http://www.baike.com/wiki/川育20,http://a3.att.hudong.com/03/34/20300000164151143272348907583_s.jpg,农业##农作物##小麦##植物##自然,川育20符合国家小麦品种审定标准，通过审定。适宜在长江上游冬麦区的四川中西部.2006～2007年度生产试验，平均亩产364.1公斤，比当地对照品种增产3.53%.川育20，春性，中熟，全生育期191天左右。幼苗半直立，分蘖力强，叶色绿，生长势旺。株高92厘米左右，略开张、整齐，成株叶片中等长宽斜上举。,中文学名：##界：##门：##亚门：##纲：##目：##科：##属：##种：##品种：,川育20##植物界##种子植物门##被子植物亚门##单子叶植物纲##禾本目##禾本科##小麦属##普通小麦##川育20
长5222,http://www.baike.com/wiki/长5222,http://a4.att.hudong.com/18/55/20300576609199158068555993536_s.jpg,农业##小麦##植物##自然,长5222这是一种农产品的名称，该品种是由山西省农业科学院谷子研究所所育种的，该农产品的特征是幼苗半匍匐，根系发达，生长稳健，茎叶挺秀，分蘖力较强。株高78厘米左右，旗叶功能期长，茎秆韧性好，抗倒伏。穗纺缍型，穗码排列适中，结实性好长芒，白壳、白粒。籽粒卵圆型，穗粒数29粒左右，千粒重45克左右。成穗率高，灌浆快，落黄好。籽粒大小均匀，商品性好。,,
刀削馒头,http://www.baike.com/wiki/刀削馒头,http://a2.att.hudong.com/55/76/01200000215977134429766949670_s.jpg,大米##小麦##玉米##面食,刀削馒头是一种常见的面食。由牛奶、鸡蛋、中粉、酵母粉发酵后蒸制而成。,中文名：##主要食材：##分类：##口味：##主食地：##制 作：,刀削馒头##中粉，牛奶，鸡蛋，酵母粉##东北菜##清淡##东北##用馒头蒸焖
昌麦26,http://www.baike.com/wiki/昌麦26,http://a0.att.hudong.com/15/42/20300544348252151135428895927_s.jpg,农业##农作物##小麦##植物##自然,昌麦26这是一种农作物品种名称，该品种是由系高代品系3461为母本，西昌16作父本杂交育成。该品种抗病毒能力强，产量高，对提高农作物的产量有很大的帮助，是生物学植物系统分类中双子叶植物纲下一个的物种名称。,中文学名：,昌麦26
楚麦十号,http://www.baike.com/wiki/楚麦十号,http://a1.att.hudong.com/68/53/20300542879568144711538701415_s.jpg,农业##小麦##植物##自然,2006～2007年参加云南省小麦品种区域试验（地麦组）。两年平均亩产278.5千克，较对照增产7.1%，增产点（次）率为81%。生产示范平均亩产292.9千克，比对照增产10.6%,中文学名：##界：##门：##纲：##目：##科：,楚麦十号##植物界##被子植物亚门##单子叶植物纲##禾本目##禾本科
打谷桶,http://www.baike.com/wiki/打谷桶,http://a2.att.hudong.com/77/99/50200009239445155962997556773_s.jpg,传统##农具##小麦##机械,打谷桶是民间较为古老的谷物收获农具，将打谷子的机器安装在上面，打谷子前，先用水浸泡一阵后就可以防止漏水，通过水的浮力，在水田里移动方便。谷子通过机器落在了打谷桶里，从而保证了谷子的干燥。,中文名：##用途：##上部面积：##桶身高：,打谷桶##稻谷、黄豆等农作物的收获脱粒##约3㎡##约70㎝
地膜小麦高产栽培技术,http://www.baike.com/wiki/地膜小麦高产栽培技术,http://a1.att.hudong.com/20/48/50200009239445156378487593420_s.jpg,图书##小麦,《地膜小麦高产栽培技术》，从理论和实践上阐述了地膜小麦增产的机理和高产的配套技术，具有较强的理论水平和可操作性。该书内容丰富，浅显易懂，可读性强．是一本很好的技术培训教材。,名称：##作者：##价格：##语种：##ISBN：##出版社：##开本：##装帧：##版次：##其他：,地膜小麦高产栽培技术##胡小平，刘义才刚##￥3.70元##中文##9787541972805##陕西人民教育出版社##16开##平装##1##纸张：胶版纸
川农25,http://www.baike.com/wiki/川农25,http://a1.att.hudong.com/48/33/20300000861164130821335884447_s.jpg,农业##农作物##小麦##植物##自然,有四川农业大学农学院培育出的优良小麦品种。,中文学名：,川农25
德抗961,http://www.baike.com/wiki/德抗961,//www.huimg.cn/entry/images/summary_default270x233.png,小麦,德抗961是德州市农科所于1992年用R-045-01（从前苏联引进）作母本，德选1号作父本，进行杂交，在含0.4%氯化钠的培养基上进行组织培养，进而筛选培育而成。2001年9月通过山东省农作物品种审定委员会审定。德抗961冬性，生育期234天，幼苗半匍匐，株型较紧凑，在土壤盐分0.3%左右时株高90厘米；叶色浓绿，分蘖力强，成穗率较高。穗型纺锤，长芒、白壳、白粒、半硬质，容重762.9克/升。较抗倒伏，高抗条锈病，中抗叶锈病，轻感白粉病。,中文名：##其他外文名：##品种来源：##特征特性：##适宜地区：,德抗961##dekang961##德州市农科所于1992年培育而成##株型较紧凑，叶色浓绿，分蘖力强##山东、河北、江苏、安徽北部等
定丰16号,http://www.baike.com/wiki/定丰16号,http://a0.att.hudong.com/88/84/20300543578952144662847512932_s.jpg,农业##农资流通##小麦##植物##生物##种子##自然,定丰16号，以自育品系8447为母本，引进材料CMS420为父本杂交选育而成，原代号9745。适宜在甘肃省海拔1700-2200米、年降水量450毫米以上的定西、临夏、甘南、白银、兰州等地种植。,中文学名：##别名：##界：##门：##纲：##目：##科：##属：##种：##亚种：,定丰16号##定丰16号麦子##植物界##被子植物门(Angiospermae)##单子叶植物纲(Monocotyledoneae)##禾本目(Poales)##禾本科(Poaceae；Gramineae)##小麦属(Triticum)##麦子##定丰16号
粉质曲线,http://www.baike.com/wiki/粉质曲线,//www.huimg.cn/entry/images/summary_default270x233.png,小麦##面点,粉质曲线是评价面团特性的重要指标之一，它可以直观地反映出面粉的稳定时间等面团流变学特性。 使用粉质仪测定小麦和面粉的粉质曲线，可以评价面粉的质量和加工特性，分析添加剂的作用，严格控制小麦的品质。 广泛的用于谷物食品原料的品质测定。,中文名：##英文名：##定义：##测定仪器：##测定标准：##作 用：##用 途：,粉质曲线##Silty curve##面团的揉混特性反映面团耐揉程度##粉质仪##吸水率、形成时间等##控制小麦的品质##谷物食品原料的品质测定
东方小麦,http://www.baike.com/wiki/东方小麦,http://a2.att.hudong.com/45/60/20300542879568144697602681816_s.jpg,农业##小麦##植物,小麦属内四倍体种之一，学名Triticum turanicum Jakubz. 或Triticum orientale Perc.，又名高拉山小麦。染色体数2n=4x=48，染色体组型为AABB。穗长，小穗密度D=15-20，护颖和内、外颖均长，内外颖几乎等长，一般1.2-1.5cm，籽粒大而长，长度为1.0-1.2cm，千粒重达60g以上，主要分布在前苏联（土库曼、乌兹别克、塔吉克）、土耳其、伊朗、伊拉克。,中文学名：##别名：##拉丁学名：##界：##门：##纲：##目：##科：##属：##种：##亚种：##分布区域：,东方小麦##高拉山小麦##Triticum turanicum Jakubz.##植物界##被子植物门##单子叶植物纲##禾本目##禾本科##小麦属##小麦##东方小麦##土库曼、乌兹别克、塔吉克
冬黑10号,http://www.baike.com/wiki/冬黑10号,http://a4.att.hudong.com/35/43/50200009239445155547439590175_s.jpg,农作物##小麦##植物##种子,冬黑10号是大穗类型。穗大子粒也较大，适合大面积中等肥力水平的土壤栽培。经过多年繁殖栽培试验表明：在中等肥力土地上亩产400~500kg。适宜在山西省中部晚熟冬麦区中水肥及肥旱地种植。,中文学名：,冬黑10号
佛手麦,http://www.baike.com/wiki/佛手麦,http://a4.att.hudong.com/06/53/20300001332647131961539122740_s.jpg,农作物##小麦##植物##生物##自然,佛手麦是小麦的一种，又称分枝小麦﹑手儿麦﹑五穗麦。麦穗分枝似佛手，故名。一般成熟较晩，品质较差。,中文学名：##别名：##界：##门：##纲：##目：##科：##属：##种：##亚种：,佛手麦##分枝小麦﹑手儿麦﹑五穗麦##植物界##被子植物门##单子叶植物纲##禾本目##禾本科##小麦属##佛手麦##佛手麦
分子标记与小麦品质改良,http://www.baike.com/wiki/分子标记与小麦品质改良,http://a3.att.hudong.com/75/97/01200000193923134408974147634_s.jpg,图书##小麦,《分子标记与小麦品质改良》是2006年中国农业出版社出版的图书，作者是郭世华。,,
汾4439,http://www.baike.com/wiki/汾4439,//www.huimg.cn/entry/images/summary_default270x233.png,小麦,汾4439，类型是强冬性，播种时间是9月下旬～10月上旬。,,
方城县小麦减产事件,http://www.baike.com/wiki/方城县小麦减产事件,http://a4.att.hudong.com/62/54/50200009239445155534546947084_s.jpg,小麦,方城县清河乡、独树镇等14个乡镇的农民因种植了方城县兆丰粮食专业合作社和方城县东盟农作物种植专业合作社推广的新麦26而导致大幅度减产，据该县统计，全县2013年小麦产量由2012年的9.36亿斤锐减到7亿多斤，减产约2亿斤。,中文名称：##时间：##发生地点：##减 产：,方城县小麦减产事件##2013##城县清河乡、独树镇等14个乡镇##约2亿斤
冬黑1号,http://www.baike.com/wiki/冬黑1号,//www.huimg.cn/entry/images/summary_default270x233.png,农作物##小麦##植物##种子,冬黑1号是多穗类型的小麦。适合大面积中上等肥力水平的土壤栽培。经过多年繁殖栽培试验表明，在中等肥力土地上亩产400~500kg。适宜山西省南部水地推广种植。,中文学名：,冬黑1号
关于印发2010年小麦最低收购价执行预案的通知,http://www.baike.com/wiki/关于印发2010年小麦最低收购价执行预案的通知,//www.huimg.cn/entry/images/summary_default270x233.png,2010年##小麦,国家有关部门安排最低收购价小麦销售后，委托收储库点要按要求及时出库，并及时归还农业发展银行贷款。 中储粮有关分公司要规范管理，统一最低收购价粮食委托收购合同文本；四、强化监督检查。 中储粮总公司及其相关分公司执行最低收购价政策收购的小麦，粮权属国务院，未经国家批准不得动用。,,
国豪麦15,http://www.baike.com/wiki/国豪麦15,//www.huimg.cn/entry/images/summary_default270x233.png,农业##小麦,小穗密度中等，平均有效穗21.0万/亩，穗粒数41.0粒/穗，千粒重50.5克。 2009-2010年度参加四川省区试，平均亩产406.3公斤，比对照绵麦37增产7.8%，8点中5点增产；2010-2011年度续试，平均亩产384.3公斤，比对照绵麦37增产10.8%，7点中6点增产。 两年区试平均亩产395.3公斤，比对照绵麦37增产9.3%。,,
灌浆肥,http://www.baike.com/wiki/灌浆肥,//www.huimg.cn/entry/images/summary_default270x233.png,小麦##水稻,主要成分：6-BA、芸苔素内酯、胺鲜酯、生理活性物质灌浆肥是有郑州中联化工产品有限公司和河南农业大学育种专家根据河南小麦生长期生理需求联手打造的技术产品之一，能够全面补充花生、大豆、玉米、小麦、水稻、棉花等营养期和孕穗结实期所需要的营养。 抗低温、抗倒伏，有效预防生理病害，增强花粉活力，提高授粉率，增加有效穗率和千粒重，减少瘪粒，病粒，籽粒饱满，可提早成熟7天以上，增产20-30%。 小麦、水稻、花生、大豆、玉米、石榴、豆角等种植作物。,中文名称：,灌浆肥
淮麦21,http://www.baike.com/wiki/淮麦21,//www.huimg.cn/entry/images/summary_default270x233.png,小麦,淮麦21，出自江苏徐淮地区淮阴农业科学研究所 ，弱春性，中熟，成熟期比对照偃展4110晚2天。幼苗半匍匐，分蘖力强，苗期长势旺，春季起身慢。,,
高优503,http://www.baike.com/wiki/高优503,http://a3.att.hudong.com/32/06/20300001199550132289066661736_s.jpg,农作物##小麦##植物,高优503，原名小偃503，一种小麦种子，由中国科学院石家庄农业现代化研究所、西北植物研究所选育。,中文学名：,高优503
国审麦2003023,http://www.baike.com/wiki/国审麦2003023,//www.huimg.cn/entry/images/summary_default270x233.png,农作物##小麦,国审麦2003023是川农16号小麦品种的品种审定编号，由四川农业大学选育，适宜在长江流域冬麦区上游的四川省、重庆市、贵州省、云南省和陕西省汉中地区中上等水肥地种植。,中文学名：,国审麦2003023
